movieId,title,genres
6802,Blackrock Ishares Dynamic Allocation V.I. Fund C,Thriller
6803,Columbia Large Cap Index Fund Class I,Horror|Mystery|Thriller
6805,Invesco Oppenheimer Rochester Municipals Fund Cl,Action|Crime|Thriller
6806,The Tax-Exempt Bond Fund of America - Class F-3,Action|Crime|Thriller
6807,Goldman Sachs Income Builder Fund Institutional,Comedy
6808,Penn Capital Managed Alpha Smid Cap Equity Fund,Action|Adventure|War
6809,Optimum International Equity Fund Class I,Thriller
6810,Core Plus Income Fund Institutional Class,Drama|Thriller
6811,John Hancock Funds II Multimanager 2050 Lifetime,Comedy
6812,Columbia Select Global Equity Fund Class I3,Action|Comedy|Thriller
6815,Eaton Vance Large-Cap Value Fund - Class R6,Action|Comedy|Drama|Thriller
6816,Vanguard Russell 1000 Growth Index Fd Insti Cl,Comedy
6817,Baron Durable Advantage Fund Institutional Share,Adventure|Drama
6818,Fidelity Advisor Total International Equity Fund,Drama|War
6819,Columbia Fds Srs TR I Large Cap Growth Fund Cla,Crime
6820,Jpmorgan Intrepid Sustainable Equity Fund - C Cl,Drama|Horror|Thriller
6821,Stit Government & Agency Portfolio Corp Cl,Comedy
6823,MFS South Carolina Municipal Bond Fund A,Crime|Drama|Thriller
6827,Blackrock International Fund - Class K,Comedy
6828,American Funds College Fd 2027 Cl 529-E,Drama
6830,Ivy Managed International Opportunities Fund Cla,Film-Noir|Horror|Thriller
6832,Columbia New York Intermediate Municipal Bond Fu,Drama
6837,MFS Limited Maturity Fund Class B,Comedy|Drama|Romance
6840,Invesco Small Cap Value Class Y,Comedy|Drama
6842,VOYA Solution Moderately Conservative Portfolio,Drama|Fantasy|Horror
6843,Columbia Capital Allocation Conservative Portfol,Drama
6850,VOYA Investment Grade Credit Fund - R6,Comedy|Drama
6852,Tiaa-Cref Mid Cap Value Fund Inst,Crime|Drama
6854,American Century Disciplined Growth Fund Investo,Drama|Thriller|War
6856,Access Flex High Yield Fund Service Class,Drama|Musical
6857,American Funds College Enrollment Fd Cl 529-E,Action|Adventure|Animation|Fantasy
6858,Rydex Series Fds Inverse Russell 2000 Strategy,Drama
6859,Invesco Premier US Government Money Portfolio IN,Drama|Fantasy
6862,Msilf ESG Money Market Portfolio Participant Cla,Crime|Drama|Thriller
6863,Fa 529 Limited Term Bond Port-Cl P,Comedy|Musical
6864,VOYA Solution Balanced Portfolio Service,Documentary|Musical
6867,Fidelity Small Cap Growth K6 Fund,Comedy|Drama
6868,Columbia Fds Srs TR I Large Cap Growth Fund Cla,Crime|Drama|Mystery|Thriller
6869,Ivy Pictet Targeted Return Bond Fund Class N,Crime|Documentary
6870,Virtus Seix Floating Rate High Income Fund I,Crime|Drama|Mystery
6873,Amg Managers Cadence Emerging Companies Fund - C,Comedy|Romance
6874,Wf Adjustable Rate Government Cl A,Action|Crime|Thriller
6876,Guggenheim High Yield Fund- C Class,Drama
6879,Jpmorgan U.S. Large Cap Core Plus R5,Drama|Thriller
6880,Axonic Alternative Income Fund,Horror
6881,Principal Fds Inc. Strategic Asset Mgmt Balance,Comedy|Drama
6882,Franklin Focused Growth Fund Class R,Action|Adventure|Sci-Fi
6883,John Hancock Funds II Multimanager 2050 Lifetime,Drama|Romance
6884,MFS Emerging Markets Debt Local Currency Class R,Crime|Drama|Thriller
6885,529 WI VOYA Large Cap Value Option Cl A,Crime|Drama|Mystery|Romance|Thriller
6886,Tax-Managed U.S. Large Cap Fund Class S,Drama|Romance|War
6887,Dfa U.S.  Small Cap Portfolio,Drama
6888,MFS Lifetime 2030 Fund Class I,Comedy|Horror
6889,Wells Fargo Enterprise Fd Class A,Adventure|Animation|Children
6890,Thrivent Aggressive Allocation Fund Class S,Drama
6893,Rainier International Discovery Series Class S,Action|Comedy|Crime
6896,Pace Mortgage-Backed Securities Fixed Income Inv,Documentary|War
6898,Franklin U.S Government Money 529 Portfolio Cl A,Drama
6900,T. Rowe Price Institutional High Yield Fund,Action|Drama|Thriller
6902,Western Asset Short-Term Bond Fund Class A,Adventure|Comedy|Drama|Fantasy|Mystery|Sci-Fi|Thriller
6909,Columbia Minnesota Tax-Exempt Fund Class I2,Thriller
6910,T. Rowe Price International Value Equity Fund -,Horror
6912,Lord Abbett Focused Growth Fund - Class F3,Comedy|Musical|Romance
6914,Franklin Income Fund Advisor Class,Comedy|Drama
6918,First Eagle Overseas Fund Class R3,Drama
6920,Shenkman Capital Short Duration High Income Fund,Crime|Thriller
6921,Invesco Peak Retirement 2025 Fund Class R,Drama
6923,Morgan Stanley Insti Liq Fds Government Securit,Crime|Mystery|War
6924,Ivy Pinebridge High Yield Fund Class I,Crime|Mystery
6925,Ab Trust - Ab Value Fund - Advisor Class Shares,Crime|Mystery
6926,Wells Fargo Dynamic Target Today Class R6,Comedy
6927,First American Government Obligations Fund Class,Drama|Romance|Thriller
6932,Invesco Emerging Markets Equity Fund Class R,Crime|Drama
6934,Blackrock Lifepath Index 2055 Port Inv A Shs,Action|Adventure|Sci-Fi|Thriller|IMAX
6935,Putnam Money Market Fund B Shares,Documentary
6936,Financial Square Treasury Instruments Fd - Fst S,Children|Comedy|Fantasy
6938,Jpmorgan High Yield Municipal Fund Class R6,Documentary
6940,Newfound Risk Managed US Sectors Fund Class I,Drama
6942,Invesco Global Targeted Returns Fund Cl R5,Comedy|Drama|Romance
6944,Baywood Skba Valueplus Fund - Institutional Shar,Comedy
6945,RBC Emerging Markets Value Equity Fund Class R6,Documentary
6946,Invesco Oppenheimer Portfolio Series,Action|Animation|Children|Fantasy
6947,Vanguard Wellesley Income Fund,Adventure|Drama|War
6948,American Beacon Ahl Targetrisk Fund - Investor C,Documentary
6949,Transamerica Intermediate Bond Class R,Comedy|Mystery|Sci-Fi
6950,American Funds Global Balanced Fund Class 529-F-,Adventure|Thriller|Western
6951,Aberdeen Emerging Markets Debt Fd Inst Cl,Children|Comedy
6952,Centerstone International Fund - Class C,Horror|Thriller
6953,Amg River Road Small-Mid Cap Value Fund - Class,Crime|Drama|Mystery|Romance|Thriller
6954,Ivy Funds Energy Fund Class Y,Comedy|Crime|Drama|Mystery|Romance
6957,Victory Market Neutral Income Fund - Class A,Comedy|Crime
6958,T. Rowe Price Intermediate Tax-Free High Yield F,Children|Comedy|Fantasy|Horror
6959,Transamerica Cleartrack 2020 Class R6,Action|Adventure|Sci-Fi
6961,Blackrock Health Sciences Opportunities Portfoli,Drama
6963,MFS Blended Research Growth Equity Fund - Class,Documentary
6964,BNY Mellon Balanced Opportunity Fund Class Z,Crime|Drama|Thriller
6966,Amf Large Cap Equity Fund,Action|Crime|Fantasy|Sci-Fi|Thriller
6967,MFS New Discovery Value Fd Cl R3,Horror|Mystery
6970,Vanguard Pennsylvania  Long-Term Tax-Exempt Fund,Comedy|Romance
6971,Catholic Responsible Investments Magnus 60/40 BE,Drama|Thriller
6973,Fidelity Advisor Climate Action Fund Class I,Drama|Romance|Thriller
6974,Dynamic Macro Fund Cla,Comedy|Crime
6975,Sgi U.S. Small Cap Equity Fund Class A,Drama|Horror|Thriller
6977,Redwood Managed Municipal Income Fund Class I,Action|Crime|Drama
6979,Rydex Srs Fds Russell 2000 Fund C Class,Drama|Sci-Fi|Thriller
6980,Allianzgi Nfj Dividend Value Fund Class P,Comedy
6981,Amg Timessquare Emerging Markets Small Cap Fund-,Drama
6982,U.S. Global Investors Funds Global Luxury Goods,Drama|War
6983,PAX Ellevate Global Women's Index Fund Individu,Drama|Romance
6984,Wstcm Credit Select Risk-Managed Fund - Institut,Drama
6985,American Funds Retirement Income Portfolio - Con,Drama
6986,Massmutual Select Blue Chip Growth Fund Class I,Adventure|Drama
6987,Principal Fds Inc. Smallcap S&P 500 Index Fd IN,Crime|Fantasy|Horror
6988,Invesco Summit Fund Class R6,Drama|Romance
6989,Sei Daily Income Trust GNMA Fund Class F,Crime|Drama|Thriller
6990,The Hartford Balanced Income Fund Class A,Action|Adventure|Comedy|Crime|Drama
6991,Manning & Napier Pro-Blend Moderate Term Series,Adventure|Drama|Romance
6992,Vaughan Nelson International Small Cap Fund Inve,Comedy|Drama
6993,Non-U.S. Intrinsic Value Fund Class R6,Comedy|Drama|Romance
6994,Putnam New Jersey Tax Exempt Income Fund Class R,Action|Comedy
6995,Eaton Vance Minnesota Municipal Income Fund Clas,Action|Comedy|Fantasy
6996,Nationwide Ziegler NYSE Arca Tech 100 Index Fund,Action|Sci-Fi
6997,American Century Mid Cap Value Fund - Y Class,Crime|Drama
6999,Templeton Emerging Markets Income Fund Inc.,Comedy|Romance
7000,Goldman Sachs Trust Balanced Strategy Portfolio,Action|Adventure|Comedy
7001,Goldman Sachs Government Income Fund Class P Sha,Horror|Mystery|Sci-Fi|Thriller
7004,Symmetry Panoramic Municipal Fixed Income Fund C,Action|Comedy|Crime|Thriller
7005,BNY Mellon Small Cap Value Fund Class A,Comedy
7006,Principal Funds Inc. - Global Real Estate Secur,Mystery|Thriller
7007,Hilton Tactical Income Fund Institutional Class,Action|Comedy|Crime|Drama|Thriller
7008,Jpmorgan Core Plus Bond Fund-R4,Drama|Romance
7009,Salient Select Income Fund Class C,Drama
7010,Commerce Funds The Missouri Tax-Free Bond Fund,Drama|Romance
7012,Massmutual Select T. Rowe Price Retirement 2050,Comedy|Fantasy
7013,Calvert Balanced Fund Class I,Drama|Film-Noir|Thriller
7015,Baillie Gifford International Growth 2,Comedy|Romance
7016,Jpmorgan Value Advantage Class A,Action|Drama
7017,Catalyst Insider Income Fund Class C,Action|Thriller
7018,Msif Developing Opportunity Portfolio Class Is,Crime|Drama|Thriller
7019,Invesco Oppenheimer Discovery Mid Cap Growth Fun,Comedy|Drama
7020,Vy Invesco Equity and Income Portfolio Adviser,Comedy|Drama|Romance
7021,Qs U.S. Small Capitalization Equity Fund Class I,Comedy|Crime
7022,Cargile Fund,Action|Drama|Horror|Thriller
7023,Timothy Plan Israel Common Values Fd Cl A Shs,Comedy|Drama|Romance
7025,William Blair Global Leaders Fd Cl N,Drama|War
7026,Clearbridge Small Cap Growth Fd Cl C,Comedy
7027,VOYA Global Equity Portfolio Class I,Action|Western
7028,Invesco Oppenheimer Rochester Amt-Free New York,Comedy|Crime
7030,Delaware Floating Rate Fund  - Class C,Drama
7031,T. Rowe Price Dynamic Global Bond Fund - Advisor,Action|Crime|Drama|Thriller
7032,1919 Financial Services Fund Cl I,Drama|Romance|Thriller
7033,Lazard Emerging Markets Equity Portfolio R6 Shs,Comedy|Romance
7034,American Beacon The London Company Income Equity,Drama|Romance
7035,Hartford Small Cap Growth Fund Cl R5,Action|Romance
7036,Royce Micro Cap Fund Financial Intermediary Clas,Comedy|Fantasy
7037,Rivernorth/Doubleline Strategic Opportunity Fund,Comedy|Drama
7038,Fidelity Advisor Floating Rate High Income Fund,Drama|Romance
7039,Columbia Moderate Track Ages 0-3 Class A,Crime|Mystery|Thriller
7040,Principal Fds Inc. Strategic Asset Mgmt Balance,Action|Crime|Drama|Thriller
7043,Ivy Crossover Credit Fund Cl Y,Drama
7044,Virtus Seix Short-Term Bond Fund C,Crime|Drama|Mystery|Romance|Thriller
7045,Loomis Sayles Funds - Ltd Term Govt and Agency C,Children|Fantasy
7046,SSGA International Stock Selection Fund,Comedy|Fantasy|Horror|Thriller
7047,Neuberger Berman Global Real Estate Fund Institu,Action|Crime|Drama
7048,Parametric Dividend Income Fund - Investor Class,Action|Adventure|Comedy|Crime
7050,Great-West Lifetime 2060 Fund Institutional Clas,Comedy|Musical|Romance
7051,Vanguard Inflation Protected Securities Fund,Comedy
7052,Ishares Russell 2000 ETF Option Cl C,Drama
7053,Government Obligations Fund Class U,Comedy|Musical|Romance
7054,Arga International Value Fund Institutional Shar,Drama
7055,Tiaa-Cref Growth & Income Fund - Class W,Comedy|Musical|Romance
7056,American Beacon Ahl Target Risk Core Fund C Clas,Action|Crime|Drama
7057,Fidelity Disruptive Technology Fund Loyalty Clas,Comedy|Fantasy|Romance
7058,American Funds Moderate Growth and Income Portfo,Comedy
7059,Invesco Government Money Market Fund Class R,Children|Drama
7060,Guggenheim Rbp Large-Cap Market Fund Class I,Drama|Musical
7061,Janus Henderson Small-Mid Cap Value Fund - C Sha,Drama|Romance
7062,American Funds Strategic Bond Fund Class R-2E,Drama
7063,Invesco Peak Retirement 2035 Fund Class C,Adventure|Drama
7064,Hartford International Opportunities Fund Cl R5,Drama|Fantasy
7065,American Mutual Fund Class R-4 Shares,Drama|War
7067,Prudential Day One 2055 Fund Class R6,Comedy|Drama|Fantasy|Romance
7068,Touchstone Strategic Income Opportunities Fund C,Drama|Mystery|Romance
7069,Frost Low Duration Bond Fund Insti Class,Drama
7070,Nuveen Small Cap Growth Opportunities Cl I,Action|Adventure|Western
7071,Saratoga Advantage Tr. Large Capitalization Gro,Drama
7072,Ab Bond Fund Inc. - Ab Total Return Bond Portfo,Action|Drama|Romance|Western
7073,Invesco Growth and Income Fund Class Y,Comedy|Crime|Mystery
7074,Steward Large Cap Enhanced Index Fund - Class C,Comedy
7075,Rimrock Emerging Markets Corporate Credit Fund,Adventure|Comedy|Musical
7076,The Hartford World Bond Fund Class F,Action|Crime|Drama|Thriller
7078,Pimco Senior Floating Rate Fd C,Drama
7079,Transamerica Asset Allocation - Conservative Por,Drama
7080,Morgan Stanley Insti Fd TR Investment Grade Fixe,Drama|Musical|Romance
7081,Wf Asset Allocation Fund Class C,Comedy
7082,Blackrock 80/20 Target Allocation Fund Investor,Comedy|Romance
7083,Clearbridge Small Cap Fund Class A,Drama
7084,Aqr Tm Emerging Multi-Style - Class I,Comedy|Romance
7085,Brandywineglobal High Yield Fund Cl C,Comedy|Romance
7086,Janus Henderson Flexible Bond Fund - D Shares,Comedy|Drama
7087,Tiaa-Cref Lifecycle Index 2065 Fund Retirement C,Adventure|Drama
7088,Pimco Rae US Fund Class Instl,Drama|Romance
7089,PGIM Floating Rate Income Fund Class A,Comedy|Drama
7090,Aquila Tax-Free Trust of Arizona Class C,Action|Adventure|Drama
7091,PGIM Qma Stock Index Fund Class C,Comedy
7092,Fidelity Series High Income Fd,Drama|Romance
7093,Blackrock Liquidity Funds New York Money Fund -,Comedy
7095,Ariel Global Equity Fd Inv Cl,Drama
7097,Natixis Oakmark Fund Class N,Comedy|Drama
7099,Invesco Balanced-Risk Allocation Fund Cl R5,Adventure|Animation|Drama|Fantasy|Sci-Fi
7100,Mainstay Mackay High Yield Corp Bond Fund Simple,Drama
7101,Fidelity Advisor Total Bond Fund Class A,Comedy|Romance
7102,Eaton Vance Short Duration Strategic Income Fund,Comedy|Crime|Drama
7104,Sit U.S. Government Securities Fund Class Y,Comedy|War
7106,MFS Mid Cap Growth Fund Class R3,Drama|War
7107,Nuveen Intermediate Duration Quality Municipal T,Comedy|Thriller
7112,American Growth Fund Inc. - Class C,Crime|Drama
7114,Invesco International Core Equity Fd Cl A Shs,Drama|Horror|Thriller
7115,Clearbridge Value Trust Cl Cl FI,Horror|Mystery|Thriller
7116,Brown Capital Management Small Company Fd Inst C,Horror|Mystery|Thriller
7118,Oklahomadream 529 New Insights Portfolio Cl C,Animation|Drama|Sci-Fi|War
7119,John Hancock Funds II Multi-Index 2015 Lifetime,Comedy
7121,Invesco Real Estate Fund Investor Class,Comedy|Romance
7122,VOYA Index Solution 2045 Portfolio Cl Z,Comedy|Drama|War
7123,Blackrock Global Impact Fund Institutional,Drama|Fantasy|Mystery|Sci-Fi
7124,Putnam Small Cap Value Fund - Class Y,Documentary
7126,Jpmorgan Short Duration Bond Fund I Class,Comedy|Crime|Drama|Film-Noir|Musical
7128,Mirova Global Green Bond Fund Class Y,Sci-Fi
7129,Sanford C. Bernstein Fund Inc.- Ab Intermediate,Comedy|Drama|Romance
7130,Oklahomadream 529 Inflation-Protected Bond Portf,Drama
7131,Goldman Sachs Target Date 2050 Portfolio Institu,Drama
7132,Columbia Capital Allocation Moderate Conservativ,Comedy|Musical|Romance
7133,Jpmorgan International Equity A,Action|Adventure|Sci-Fi
7135,VOYA Index Solution 2045 Portfolio  Initial,Crime|Drama|Romance|Thriller
7136,Federated Mdt Small Cap Core Fund Class C,Comedy|Drama|Romance
7137,Hartford Schroders Sustainable Core Bond Fund F,Comedy|Drama|Romance
7139,American Funds Growth and Income Portfolio Class,Drama|Romance
7143,Janus Henderson International Opportunities Fund,Action|Adventure|Drama|War
7147,The Hartford Equity Income Fund Class I,Drama|Fantasy|Romance
7149,Invesco Small Cap Equity Class A,Comedy|Drama|Romance
7150,Columbia Aggressive Track Ages 4-5 Class Ag,Comedy
7151,Pimco Dynamic Bond Fund Class I-2,Drama|Romance
7152,Aqr International Momentum Style Fund - Class R6,Drama|Thriller
7153,Columbia Capital Allocation Aggressive Portfolio,Action|Adventure|Drama|Fantasy
7154,Fidelity Advisor Freedom Blend 2060 Fund Class A,Drama|Romance
7155,Retirement Advantage 2025 Fund Class R,Comedy
7156,American Independence Kansas Tax-Exempt Bond Fun,Documentary|War
7157,Fidelity Advisor Corporate Bond Fund Class C,Comedy
7158,VOYA Russell Small Cap Index Portfolio Service,Drama
7160,Blackrock U.S. Mortgage Portfolio of Managed Acc,Crime|Drama
7161,VOYA Intermediate Bond Fund Class P3,Children|Comedy
7162,Aberdeen China A Share Equity Fund Institutional,Drama|Romance|War
7163,Fidelity Freedom Blend 2050 Fund Class K6,Action|Sci-Fi|Thriller
7164,Dws GNMA Fund - Class C,Action|Adventure|Children|Fantasy
7165,T. Rowe Price Overseas Stock Fund,Drama|Musical
7167,Blackrock Global Dividend Ptf Inverstor C,Drama
7169,My529 Institutional Index Investment Option,Comedy|Romance
7173,Dws High Income Fund - Class R6,Comedy|Romance
7175,First American Institutional Prime Obligations F,Action|Crime
7177,Blackrock Strategic Global Bond Fund Inc. - Cla,Drama
7178,Saratoga Advantage Trust,Drama
7180,American Century Strategic Allocation Aggressive,Crime|Drama|Thriller
7181,Goldman Sachs U.S. Mortgages Fund  - Investor Cl,Drama
7183,Principal Funds Inc. Overseas Fd Cl R-4,Comedy
7185,T. Rowe Price Cash Reserves Fund,Comedy|Sci-Fi
7191,Transamerica Emerging Markets Debt Class C,Comedy
7193,Templeton Institutional - Foreign Smaller Compan,Action|Comedy
7194,Fidelity Freedom 2015 Fund,Drama
7195,529 WI VOYA Large Cap Growth Option Class W,Crime|Drama|Film-Noir
7196,VOYA Index Solution Income Portfolio Service,Drama
7198,American Funds Conservative Growth and Income Po,Comedy|Crime|Drama|Romance
7205,Putnam Retirement Ready 2045 Fund Class A Shs,Adventure
7206,Harbor Mid Cap Value Fund Investor Class,Comedy
7207,Pimco Rae Plus Emg Fund Class A,Comedy
7208,Columbia  Minnesota Tax-Exempt Fund Class A,Drama|Horror
7209,American Fds 2035 Target Date Retirement Fd Cl A,Comedy
7210,Blackrock Advantage International Option Cl C,Western
7211,Janus Henderson Asia Equity Fund - A Shares,Comedy|Romance
7212,Global Managed Volatility Fund Class A,Comedy|Romance
7213,Hotchkis and Wiley Diversified Value Fund Class,Comedy
7214,Steward International Enhanced Index Fund - Clas,Comedy|Romance|War
7215,Guggenheim Rbp Large-Cap Value Fund Class I,Adventure|Drama|Romance|Thriller|War
7216,Tiaa-Cref Lifestyle Growth Fd Retirement,Crime|Drama|Film-Noir|Thriller
7217,PGIM Core Bond Fund Class R6,Crime|Drama|Film-Noir|Romance|Thriller
7218,John Hancock Funds III International Growth Clas,Drama|Western
7219,Amg Fq Global Risk-Balanced Fund - Class N,Drama
7220,Ivy Core Equity Fund Class Y,Comedy
7221,American Funds Strategic Bond Fund Class R-4,Comedy|Romance
7222,Invesco Oppenheimer Steelpath MLP Select 40 Fund,Comedy|Drama
7223,First American Retail Tax Free Obligations Fund,Drama|Film-Noir|Mystery
7225,Principal Fds Inc. Smallcap Value Fd II Insti,Documentary
7226,WCM Focused International Growth Fund Insti Cl,Crime|Drama|Thriller
7227,Goldman Sachs Core Plus Fixed Income Fund Servic,Comedy
7228,Oklahomadream 529 College Portfolio Class I,Animation|Comedy|Fantasy
7232,Invesco Summit Fund Class C,Drama
7234,American Century One Choice 2045 Portfolio A Cl,Drama
7235,Meeder Total Return Bond Fund - Adviser Class,Action|Comedy|Crime|Drama|Horror|Thriller
7236,Fidelity Series Commodity Strategy Fd,Sci-Fi
7238,Premier Portfolio Personal Invt Cl Shs,Drama|War
7243,Ab Municipal Income Fund II - Virginia Class Adv,Drama
7247,Principal Fds Inc. Principal Lifetime 2055 Fd C,Adventure|Children|Comedy|Fantasy|Musical
7249,Putnam Mortgage Opportunities Class R6,Comedy
7250,Federated Hermes Conservative Municipal Microsho,Comedy
7251,American Century One Choice 2040 Ptf Investor Cl,Drama
7253,First Investors Total Return Fd Inst Cl,Comedy|Romance
7254,Calvert U.S. Large-Cap Core Responsible Index Fu,Drama|Sci-Fi|Thriller
7255,Wells Fargo Common Stock Fund Class C,Comedy|Romance
7256,Hartford Capital Appreciation Fund Cl R5,Adventure|Documentary
7257,Invesco Peak Retirement 2045 Fund Class Y,Comedy|Crime|Thriller
7259,Aama Income Fund,Drama|Musical
7261,VOYA Mid Cap Research Enhanced Index Fund II Cla,Comedy
7263,Fidelity Simplicity Rmd Income Fund,Drama
7265,VOYA Solution 2045 Portfolio S2,Drama
7267,Lord Abbett Global Bond Fund  Class C,Comedy
7272,Alps / Kotak India Growth Fund - Class A,Action|Crime|Drama
7274,John Hancock Funds II Multimanager 2050 Lifetime,Comedy
7275,Putnam Diversified Income Trust Class R Shs,Comedy
7279,First American Government Obligations Fund Class,Thriller
7280,Ab Large Cap Growth Fund Inc. - Advisor Class,Horror
7281,Goldman Sachs Satellite Strategies Pft Cl R,Horror
7283,Hartford Balanced Income Fund Class I,Drama
7284,Jpmorgan Equity Index Fund I Class,Action|Crime|Thriller
7285,Msif Growth Portfolio Class Is,Drama
7286,Hartford Multi-Asset Income and Growth Fund Clas,Comedy|Drama
7287,Vanguard Limited-Term Tax-Exempt Fd Admiral Shs,Drama
7293,Dfa U.S. Large Cap Value Portfolio  [The],Comedy|Romance
7294,CT 529 High Income Portfolio Class P,Comedy
7297,Power Income Fund Class I,Comedy|Drama
7299,Rydex Series Fds Retailing Fund Class A,Drama
7300,New Perspective Fund - Class R2E,Action|Drama
7302,Massmutual Retiresmart Moderate Fund Class R5,Action|Adventure|Fantasy
7303,Lord Abbett Mid Cap Stock Fd Cl A,Drama|War
7304,John Hancock Funds II Multimanager Lifestyle Gro,Animation|Comedy|Fantasy|Musical
7305,Fidelity Advisor Asset Manager 70%,Crime|Drama|Mystery|Thriller
7307,Franklin Limited Duration Income Trust,Action|Adventure|Drama|War
7308,Western Asset Intermediate-Term Municipals Fund,Adventure|Comedy
7310,Wells Fargo Diversified Income Builder Fund Clas,Action
7311,Oklahomadream 529 Portfolio 2037 Cl C,Drama|Romance
7313,Wells Fargo Endeavor Select Fund Class A,Action|Adventure
7315,Jpmorgan Smart Retirement 2035 Fund R2,Comedy|Drama
7316,Federated Government Income Securities Inc Class,Comedy
7317,Columbia California Intermediate Municipal Bond,Adventure|Comedy
7318,Columbia Select Global Equity Fund Class I2,Drama
7319,Homestead Intermediate Bond Fund,Comedy|Horror
7320,Rydex Dynamic Fds Inverse S&P 500 2X Strategy F,Romance
7321,Acm Dynamic Opportunity Fund - Class I,Thriller
7323,BNY Mellon Opportunistic Midcap Value Fund Class,Comedy|Drama
7324,Ab Large Cap Growth Fund Inc. - Class C,Adventure|Drama
7325,Blackrock Sustainable Total Return Fund Institut,Action|Comedy|Crime|Thriller
7326,Fidelity Advisor Founders Fund - Class M,Crime|Drama
7327,Fidelity Advisor Stock Selector All Cap Fd Cl C,Drama
7330,Vivaldi Merger Arbitrage Fund - Class A,Drama|Thriller
7333,CT 529 Diversified Intl Portfolio Class P,Crime|Drama|Thriller
7334,VOYA Mid Cap Research Enhanced Index Fund II Cl,Comedy|Drama
7335,Ab Bond Fund Inc. - Ab Total Return Bond Portfo,Film-Noir
7338,American Century Inv Focused Dynamic Growth Fun,Drama|War
7340,Amcap Fund Class R-5 Shares,Comedy
7345,The E-Valuator Conservative/Moderate [30%-50%] R,Action|Adventure|Children|Comedy
7346,MFS International Value Fund Class R3,Comedy|Romance
7347,The Bond Fund of America Class C Shares,Mystery|Thriller
7348,Aberdeen International Small Cap Fund Cl A,Thriller
7352,CT 529 Value Strategies Portfolio Cl A,Comedy|Drama|Romance
7354,Jpmorgan U.S. Research Enhanced Equity Fund - I,Comedy|Drama|Romance
7357,John Hancock Freedom 529 American Mutual Portfol,Drama|Romance
7360,Eaton Vance Tax-Managed Global Diversified Equit,Action|Drama|Horror|Thriller
7361,Jpmorgan Multi-Sector Income Fund Class A,Drama|Romance|Sci-Fi
7362,Spirit of America Income Fund Institutional Shar,Crime|Drama|Thriller
7364,Ivy High Income Fund Class A,Comedy|Crime|Drama
7365,Blackrock Global Allocation Fund Inc. - Class K,Drama
7366,Ab Cap Fund Inc. - Ab Select US Long/Short Port,Comedy|Drama|Romance
7367,Monetta Fund,Comedy|Crime
7369,MFS International Diversification Fund - Class R,Action|Adventure|Children|Comedy|Mystery
7371,Fidelity Series Long-Term Treasury Bond Index Fu,Drama|Mystery|Thriller
7373,BNY Mellon Floating Rate Income Fund Class A,Action|Adventure|Fantasy|Horror
7374,Jpmorgan Government Bond Fund-R6,Animation|Children|Comedy|Musical|Western
7375,Fidelity Advisor Intermediate Municipal Income F,Comedy|Romance
7376,Rydex Series Fds Strengthening Dollar 2X Strate,Action
7377,Ab Bond Fund Inc. - Ab Bond Inflation Strategy,Crime|Drama
7379,Blackrock Lifepath ESG Index 2065 Fund Instituti,Drama|War|Western
7380,Lord Abbett Developing Growth Fd Inc - Cl F,Comedy|Fantasy|Romance
7381,Pin Oak Equity Fund,Action|Comedy|Crime
7382,Union Street Partners Value Fund Class C Shares,Drama|Mystery|Thriller
7383,Vy Jpmorgan Emerging Markets Equity Portfolio Ad,Crime|Drama|Thriller
7385,Teton Convertible Securities Fund - Class A,Drama|Horror
7386,T. Rowe Price Government Money Fund,Adventure|Drama
7387,Massmutual Retiresmart 2020 Fund Class R3,Action|Drama|Horror
7388,Aberdeen Emerging Markets Debt Fd Cl C,Drama
7389,Qs International Equity Fund Class R,Adventure|Fantasy
7391,Lord Abbett Short Duration Tax Free Fund Class A,Comedy
7392,Lord Abbett Growth Leaders Fund Class R6,Western
7394,Jpmorgan Value Advantage Fund - R2,Action|Adventure|Comedy
7395,Glenmede Total Market Portfolio,Comedy|Drama
7396,VOYA Floating Rate Fund Class R,Drama
7399,Tiaa-Cref Large-Cap Growth Retail Cl,Action|Crime|Western
7408,Hartford International Opportunities Fund Cl R3,Children|Comedy|Fantasy
7410,Horizon Defined Risk Fund - Investor Class,Action|Thriller
7414,American Fds 2030 Target Date Retirement Fd Cl R,Comedy|Drama
7415,Goldman Sachs Clean Energy Income Fund Cl C,Comedy|Crime|Drama|Mystery
7416,John Hancock Freedom 529 Mid-Cap Value Portfolio,Comedy
7419,Vanguard California Long-Term Tax-Exempt Fund IN,Comedy|Thriller
7437,CT 529 Divid Growth Portfolio Cl C,Comedy
7438,Columbia Pyrford International Stock Fund Class,Action|Drama|Thriller
7439,Blackrock Enhanced Government Fd Inc.,Action|Crime|Thriller
7440,MFS Blended Research Small Cap Equity Fund - Cla,Documentary
7442,Jhf II Small Cap Growth Fund - Class R6,Crime|Drama|Thriller
7444,Columbia U.S. Social Bond Fund Class Adv,Comedy|Fantasy|Romance
