movieId,title,genres
59604,American Beacon Small Cap Value Fund Advisor Cla,Crime|Drama|Horror|Thriller
59615,Principal Funds Inc. -Smallcap Value Fund II,Action|Adventure|Comedy|Sci-Fi
59621,Great-West Core Bond Fund - Institutional Class,Comedy|Crime|Mystery|Thriller
59684,T. Rowe Price Retirement Blend 2015 Fund,Documentary
59709,John Hancock Tax Advantaged Dividend Income Fd,Crime|Mystery|Romance|Thriller
59721,Goldman Sachs High Yield Municipal Fund  - Inves,Comedy
59725,Qs Conservative Growth Fund Class C,Comedy|Romance
59727,Columbia Adaptive Retirement 2040 Fund Class I3,Horror|Thriller
59731,The Korea Fund Inc.,Documentary
59738,Swan Defined Risk Fund Class C,Horror|Mystery|Thriller
59784,PGIM ESG High Yield Fund Cl A,Action|Animation|Children|Comedy|IMAX
59810,Eventide Core Bond Fund Class I,Drama
59832,Blackrock Sustainable U.S. Growth Equity Fund Cl,Crime|Drama|Film-Noir
59838,Touchstone Large Company Growth Fund Class A,Western
59850,Fidelity Advisor Capital Development Fund,Crime|Mystery|Thriller
59900,Invesco High Yield Municipal Class C,Comedy
59908,Hc Capital Trust The Insti International Equity,Comedy
59910,Touchstone Large Cap Focused Fund Class A,Drama
59912,Blackrock Lifepath Index 2040 Port Insti Cl,Comedy|Crime|Drama
59942,Virtus Vontobel Global Opportunities Fund A,Adventure
59960,Franklin Mutual Financial Services Fund Class A,Romance|Western
59976,Nuveen California Amt-Free Quality Municipal Inc,Drama
59985,American Funds Global Balanced Fd Cl R-3,Comedy|Drama|Romance
59995,BNY Mellon Income Stock Fund - Class Y,Crime|Drama
60020,Eaton Vance Short Duration Strategic Income Fund,Action|Drama|War
60037,Pimco All Asset Class A,Drama|Sci-Fi|Thriller
60040,Prudential Day One 2060 Fund Class R3,Action|Sci-Fi
60044,Tiaa-Cref Emerging Markets Equity Fund Instituti,Comedy|Drama|Horror
60046,Wf Large Cap Core Fund Class Insti Class,Drama|War
60069,Western Asset Core Plus Bond Fund Class FI,Adventure|Animation|Children|Romance|Sci-Fi
60072,Calvert Income Fund Class I,Action|Thriller
60074,Goldman Sachs Small/Mid-Cap Growth Fund Inst Cl,Action|Adventure|Comedy|Crime|Fantasy
60103,Wf Large Cap Core Fund - R,Crime|Drama|Film-Noir
60126,1919 Socially Responsive Balanced Fund Class I,Action|Comedy
60133,American Century One Choice 2050 Ptf R Class,Drama
60137,Virtus Kar Global Quality Dividend Fund R6,Documentary
60147,Goldman Sachs Short Duration Tax-Free Fund  - IN,Drama
60161,Tiaa-Cref International Equity Fund - Class W,Action|Animation|Comedy|Romance|Sci-Fi
60227,Invesco Oppenheimer Capital Appreciation Fund Cl,Crime|Drama|Romance
60243,BNY Mellon International Stock Fund Class Y,Comedy|Western
60291,Transamerica Short-Term Bond R6,Documentary
60293,Rydex Series Fds Commodities Strategy Fund C Cl,Comedy|Drama|Romance
60295,The Small Cap Opportunities Fd Adv Cl A A Series,Documentary
60311,The Hartford World Bond Fd Cl C,Adventure
60314,Wells Fargo Enterprise Fund Class I,Western
60316,Fidelity Advisor Communication Services Fund Cla,Western
60333,American Century California Intermediate-Term Ta,Documentary
60338,Hartford Environmental Opportunities Fund Class,Sci-Fi|Thriller
60363,Catalyst MLP & Infrastructure Fund Class A,Comedy|Horror
60382,Federated Ultrashort Bond Fund  A Shares,Documentary
60397,Emerging Markets Ex China Core Equity Portfolio,Comedy|Musical|Romance
60436,Fmi Large Cap Fund Investor Class,Drama
60471,Artisan Thematic Fund - Investor Shares,Action|Adventure|Horror|Thriller
60482,Great-West Lifetime 2015 Fund Institutional Clas,Drama
60487,Amana Growth Fund Institutional Class,Animation|Children|Comedy
60503,Nationwide Government Money Market Fund Service,Drama|War
60514,Pimco Fds Pacific Inv Management Ser All Asset,Action|Adventure|Sci-Fi
60516,Goldman Sachs Financial Sq Treasury Obligations,Adventure|Children|Comedy|Romance|Sci-Fi
60526,Locorr Market Trend Fund - Class I,Drama|Romance|Thriller
60530,Lsv Small Cap Value Fund - Investor Class,Drama
60551,Principal Fds Inc. Real Estate Securities Fd IN,Drama
60566,Neuberger Berman Mid Cap Growth Fd Advisor Cl,Crime|Drama|Thriller
60579,Invesco U.S. Government Money Portfolio Class R6,Horror|Mystery|Thriller
60609,Polaris Global Value Fund,Adventure|Crime|Drama|Horror|Mystery
60647,Transamerica International Stock Class I2,Crime|Drama|Thriller
60674,MFS Government Markets Income Trust,Sci-Fi
60684,Praxis Growth Index Fund - Cl I,Action|Drama|Mystery|Sci-Fi|Thriller|IMAX
60688,Thornburg Investment Income Builder Class A,Action|Drama|Mystery|Thriller|War
60735,WCM Focused ESG Emerging Markets Fund Investor C,Drama|Thriller
60753,Columbia Virginia Intermediate Municipal Bond Fu,Crime|Drama
60756,Pacific Funds Short Duration Income - Class A,Comedy
60758,UBS Select ESG Prime Investor Fund,Drama
60760,MFS Blended Research Mid Cap Equity Fund - Class,Drama|Mystery|Sci-Fi|Thriller
60766,Rydex Series Fds Leisure Fund H Class,Documentary
60816,Capital Income Builder Class 529-F-2,Adventure|Comedy|Fantasy
60825,Nuveen Real Estate Securities Fund Class R6,Action|Horror|Thriller
60832,Calamos High Income Fund Class A,Crime|Horror|Thriller
60894,Janus Henderson Triton Fund - A Shares,Drama|Romance|War
60904,Pimco Rae Emerging Markets Fund Class A,Comedy|Drama|Sci-Fi
60937,Janus Henderson Global Research Fund - T Shares,Action|Adventure|Fantasy|Thriller
60939,Tiaa-Cref Large-Cap Growth Retirement Cl,Comedy|Drama
60941,Fa 529 Diversified Intl Port-Cl C,Horror|Mystery|Thriller
60943,Equity Income Fund - Class C,Drama
60948,First American Government Obligations Fund Class,Drama
60950,T.Rowe Price 2025 Retirement Fund Advisor Class,Comedy|Drama|Romance
60979,Sei Insti Inv TR Small/Mid Cap Equity Fund Cl A,Action|Animation|Crime
61004,Fidelity Freedom Index 2030 Fund Premier Class,Action|Romance|Thriller
61011,Allianzgi High Yield Bond Fund Class C,Drama|Mystery
61024,Hartford Global Impact Fund Class I,Action|Comedy|Crime
61026,Baron Real Estate Fd Retail Shs,Action|Adventure|Drama|War
61031,Janus Henderson Forty Fund - R Shares,Comedy
61048,Franklin Growth Allocation 529 Portfolio Cl C,Comedy|Drama|Romance
61071,Tiaa-Cref Lifecycle Index 2010 Fund Instl,Adventure|Comedy|Drama|Romance
61075,American Funds Growth and Income Portfolio Class,Drama|Romance
61123,Carillon Eagle Mid Cap Growth Fund Class R-3,Comedy|Drama|Musical|Romance
61132,Pimco Climate Bond Fund Class I-3,Action|Adventure|Comedy|War
61136,Tiaa-Cref Lifecycle Fd 2055 Premier,Horror|Sci-Fi|Thriller|War
61160,Msift High Yield Portfolio Class W,Action|Adventure|Animation|Sci-Fi
61210,Invesco Peak Retirement 2040 Fund Class A,Action|Adventure|Sci-Fi
61236,Pioneer Emerging Markets Equity Fund  - Class Y,Animation|Documentary|Drama|War
61240,Franklin Mutual Shares Fund Class A,Drama|Fantasy|Horror|Romance
61246,MFS Blended Research Emerging Markets Equity Fun,Comedy
61248,Pimco Long-Term U.S. Government Fund Class I-2,Action|Adventure|Sci-Fi|Thriller
61250,Kellner Merger Fund Institutional Class,Comedy
61253,MFS Lifetime 2060 Fund - Class I,Drama
61255,BNY Mellon S&P 500 Index Fund,Comedy
61257,Hartford Schroders US Small Cap Opportunities Fu,Documentary
61262,Massmutual Select Blue Chip Growth Fund Class A,Horror|Mystery|Thriller
61289,Wf International Bond Fund Administrator Class,Action|Western
61312,Wells Fargo Heritage Money Market Service Cl,Comedy|Drama
61317,Tiaa-Cref Equity Index Fund - Class W,Action|Crime|Mystery|Thriller
61319,Aberdeen Global Equity Fund Class C,Drama
61323,Fidelity Advisor Value Fund,Comedy|Crime|Drama
61348,Touchstone Ultra Short Duration Fixed Income Fd,Comedy
61350,Harding Loevner International Equity Portfolio I,Action|Adventure|Sci-Fi|Thriller
61352,Usaa California Bond Fund Adv Shs,Crime|Drama|Thriller
61354,Hartford Total Return Bond Fund Cl R5,Comedy
61361,Clearbridge Variable Large Cap Growth Portfolio,Comedy|Drama
61394,Fidelity Advisor Small Cap Fd Cl Z,Comedy
61396,American Funds Corporate Bond Fund - Class 529-C,Crime|Western
61401,MFS Global Alternative Strategy Fund Class I,Action|Comedy|Fantasy|Thriller
61406,Wells Fargo Moderate Balanced Fund Institutional,Drama
61434,PGIM Global Real Estate Fund Class R4,Musical|War
61449,Wf Common Stock Fund  Admin Class,Drama|Romance
61451,FS Chiron Capital Allocation Fund Cl A,Drama|War
61465,T. Rowe Price Retirement Blend 2045 Fund,Action|Crime|Thriller
61467,Sparrow Growth Fund No Load,Comedy|Romance
61470,Invesco Oppenheimer Rochester High Yield Municip,Drama|War
61692,Columbia Seligman Communications and Information,Horror|Sci-Fi|Thriller
61697,Pioneer Multi-Asset Income Fd Cl A,Crime|Mystery|Thriller
61705,Oklahomadream 529 Small Cap Portfolio Class P,Drama|Thriller
61729,Inflation-Adjusted Bond Fund - R6 Class,Comedy|Fantasy|Romance
61862,Blackrock Lifepath Retirement Portfolio Investor,Drama
61934,MFS Georgia Municipal Bond Class B,Action|Comedy
61941,VOYA Index Solution 2055 Portfolio S2,Comedy|Drama
61950,Columbia Virginia Intermediate Municipal Bond Fu,Thriller
61986,Pace Global Fixed Income Investments Cl P,Western
62049,Baird Quality Intermediate Municipal Bond Fund -,Drama|Sci-Fi
62081,MFS Emerging Markets Equity Fund Class R2,Action|Crime|Thriller|IMAX
62113,Touchstone Focused Fd Cl A,Comedy
62115,Rydex Series Fds Mid-Cap 1.5X Strategy Fd Cl H,Comedy|Drama
62153,Tcw Enhanced ComMmodity Strategy Fund Class I,Drama
62155,Lord Abbett Multi-Asset Income Fund- Class I,Comedy|Drama|Romance
62198,Institutional Fiduciary Trust Money Market Pt,Documentary
62203,Power Dividend Index Fund Class A,Horror
62208,Ishares TIPS Bond ETF 529 Portfolio Cl C,Drama
62235,Mainstay Balanced Fund Class B A Ser of The Ecl,Drama|Thriller
62250,John Hancock Freedom 529 New Horizons Portfolio,Crime|Drama
62265,Lord Abbett Global Equity Research Fund - Class,Comedy|Romance
62293,Tcw Relative Value Large Cap Fund Cl I,Drama|Romance
62331,Harding Loevner Fund Inc. International Eq Pt,Action|Adventure|Animation|Comedy|Sci-Fi
62336,Principal Funds Inc. - Spectrum Preferred and C,Animation|Comedy|Fantasy|Sci-Fi
62344,Invesco Peak Retirement 2045 Fund Class R,Drama|Romance
62374,Federated Kaufmann Fund Classr,Action|Drama|Thriller
62376,Janus Henderson Asia Equity Fund - I Shares,Adventure|Children|Sci-Fi
62378,Fidelity Advisor Freedom Blend 2065 Fund Class Z,Comedy
62394,American Funds Tax-Exempt Preservation Portfolio,Action|Crime|Drama|Thriller
62434,Segall Bryant & Hamill Fundamental International,Comedy|Drama|Romance
62437,Putnam Panagora Risk Parity Fund Class R,Drama
62439,Putnam Tax Exempt Income Fund Y Shs,Comedy|Romance
62511,Angel Oak High Yield Opportunities Fund Class A,Comedy|Drama
62514,Allianzgi International Small-Cap Fd Cl C,Drama
62526,Pioneer Fund Class C Shares,Mystery|Thriller
62553,Multi Asset Accumulation Fund Class Y,Drama
62577,Fidelity Sustainability U.S. Equity Fund,Drama
62586,T.Rowe Price 2035 Retirement Fund R Class,Comedy|Fantasy
62644,Wells Fargo Dynamic Target 2040 Class R6,Drama
62718,Ab Core Opportunities Fund Inc. - Class I,Comedy|Romance
62733,Jpmorgan Smartretirement 2025 Fund I Class,Drama|Horror|Mystery|Thriller
62764,Quantified Managed Income Fund Investor Class,Fantasy|Mystery|Sci-Fi|War
62788,Ivy Value Fund Class Y,Comedy|Horror|Thriller
62792,Invesco Global Targeted Returns Fund Cl R,Crime|Drama
62799,Weitz Ultra Short Government Fund - Institutiona,Drama
62801,Goldman Sachs Mid Cap Value Fund Class R,Action|Drama
62803,John Hancock Managed Account Shares Securitized,Action
62849,American Fds The Tax-Exempt  Bond Fund of Ameri,Action|Crime
62956,Clifford Capital Focused Small Cap Value Fund IN,Action|Adventure|Animation|Comedy|Fantasy|Sci-Fi
62970,Nationwide Destination 2025 Fd Cl Inst Svc,Adventure|Fantasy|Sci-Fi
62999,Mainstay Mackay International Equity Fund Class,Action|Adventure|Animation|Children|Comedy|IMAX
63033,Sterling Capital Mid Value Fund Class R6,Drama|Mystery|Romance|Thriller
63062,Columbia Conservative Track Ages 4-5 Class C,Crime|Drama|Mystery
63072,Invesco Advantage Muni Income Trust II,Adventure|Drama|Thriller
63082,T. Rowe Price Tax-Free Income Advisor Class,Crime|Drama|Romance
63113,MFS Total Return Bond Fund Class B,Action|Adventure|Thriller
63121,Templeton Developing Market Trust - Class R,Drama|Romance
63131,Eaton Vance Value Opportunities Fd Cl A,Comedy
63181,Lord Abbett Growth Opportunities Fd - Cl R2,Action|Horror
63189,Dws Rreef Real Assets Fund - Class C,Horror|Mystery
63222,Putnam Retirement Income Fund Lifestyle 1 Class,Action|Drama|Thriller
63283,Blackrock Funds II Blackrock Multi-Asset Income,Comedy|Crime
63433,529 WI Tiaa-Cref International Equity Index Opti,Action|Adventure|Sci-Fi
63436,Miller Income Fund Cl FI,Crime|Horror|Thriller
63479,Federated Mdt Balanced Fund Institutional Class,Comedy
63481,Wells Fargo C&B Mid Cap Value Fund Class R6,Comedy|Musical
63515,Nationwide International Index Class C,Drama|Mystery
63540,Eaton Vance Tabs 10-To-20 Year Laddered Municipa,Adventure|Children|Comedy
63808,Invesco Government & Agency Portfolio Institutio,Drama
63826,Crm All Cap Value Fund Institutional Class,Action|Horror|Thriller
63853,PGIM Global Total Return Fund Class Z,Adventure|Drama|War|Western
63859,American Funds Strategic Bond Fund Class R-3,Action|Adventure|Animation|Children|Comedy
63876,Grandeur Peak Emerging Markets Opportunities Fd,Drama
63989,Locorr Dynamic Equity Fund - Class I,Horror|Sci-Fi
63992,Putnam Global Technology Fund C Shs,Drama|Fantasy|Romance|Thriller
64010,BNY Mellon Amt-Free Municipal Bond Fund Class C,Horror
64030,Invesco European Growth Fund Class C,Action|Adventure|Crime|Thriller
64032,American Funds Corporate Bond Fund - Class F-2,Comedy
64034,Oklahomadream 529 Equity Income Portfolio Cl A,Drama|War
64037,Allianzgi Nfj Dividend Value Fund Class A,Crime|Mystery|Thriller
64116,Fidelity  New Jersey Municipal Income Fund,Animation|Comedy
64197,Principal Funds Inc. - Principal Lifetime 2060,Drama
64229,Janus Henderson Balanced Fund - R Shares,Drama|Musical
64231,Virtus Newfleet Tax-Exempt Bond Fund A,Action|Crime|Drama|Thriller
64278,T. Rowe Price Target Retirement 2015 Fund Adv Cl,Documentary
64285,VOYA Solution Moderately Aggressive Portfolio S2,Animation|Comedy
64497,Columbia Growth 529 Port Ag - Static,Drama|Sci-Fi|Thriller|IMAX
64499,Clarkston Fund Institutional Class,Drama|War
64511,Fidelity Advisor 529 Portfolio 2022,Comedy|Drama
64517,Goldman Sachs Local Emerging Markets Debt Fund,Crime|Drama
64519,Msif International Equity Class C,Crime|Drama|Film-Noir
64575,Victory Rs Value Fund - Class R,Drama|Mystery
64614,Sterling Capital Behavioral Large Cap Value Equi,Crime|Drama
64620,Independent Franchise Partners US Equity Fund,Drama
64622,VOYA Limited Maturity Bond Portfolio Initial,Drama|Romance
64701,Invesco Oppenheimer Rochester Pennsylvania Munic,Drama|Mystery
64716,Payden Equity Income Fund Adviser Cl,Drama
64839,Goldman Sachs U.S. Equity Insights Fund Investor,Drama
64930,Fidelity Advisor Freedom 2025 Fund Class Z,Comedy|Romance
64957,Janus Henderson Global Sustainable Equity Fund T,Drama|Fantasy|Mystery|Romance
64969,Oberweis International Opportunities Institution,Comedy
64983,American Beacon Ahl Targetrisk Fund - Y Class,Drama|Thriller|War
64990,Msif Global Real Estate Class C,Documentary
64993,Calvert Emerging Markets Equity Fund Class I,Animation|Drama|Romance
64997,Pzena International Value Fund Investor Class,Action|Sci-Fi
65045,Massmutual Retiresmart Growth Fund Class R4,Mystery|Sci-Fi|Thriller
65088,Janus Henderson Forty Fund - D Shares,Adventure|Children|Comedy
65091,Pioneer Flexible Opportunities Fund - Class Y,Crime|Drama|Romance
65126,Clearbridge Dividend Strategy Fund Class 1,Comedy|Drama
65130,Massmutual Select Blue Chip Growth Fund Service,Drama|Romance
65133,Wpg Partners Small/Micro Cap Value Fund Institut,Comedy
65135,First Eagle Fund of America Class R5,Comedy
65155,Riverbridge Growth Fund - Investor Class,Comedy
65181,Parametric International Equity Fund Institution,Comedy|Crime|Drama|Thriller
65188,Sierra Tactical All Asset Fund Instl Class,Documentary
65216,Lkcm Equity Fund Institutional,Drama|Thriller|War
65225,State Street U.S. Government Money Market Fund -,Documentary
65230,Metropolitan West Unconstrained Bond Fd Cl M Shs,Comedy|Drama
65256,WCM Focused International Growth Fd Inv Cl,Crime|Drama|Mystery
65261,Davis Opportunity Fund Class A,Adventure|Animation|Children|Fantasy
65304,Fa 529 Port 2031-Cl A,Drama|Mystery|Thriller
65359,Hartford Schroders Securitized Income Fund - Cla,Adventure|Drama|Fantasy
65381,Eaton Vance Balanced Fund Class A,Western
65418,Dws Government & Agency Securities Portfolio Se,Drama
65465,Mainstay Map Equity Fund - Investor Class,Drama|Romance
65514,Meeder Balanced Fund - Adviser Class,Action|Drama|War
65552,The Hartford Floating Rate High Income Fd Cl C,Action|Sci-Fi|Thriller
65567,Neuberger Berman Mid Cap Growth Fd Insti Cl,Drama|Mystery|Thriller
65577,Symmetry Panoramic US Fixed Income Fund Class I,Adventure|Animation|Children|Comedy|Fantasy
65585,Fa 529 Equity Growth Port-Cl D,Comedy|Romance
65596,Blackrock Muniyield Pennsylvania Quality Fd,Action|Crime|Drama|Thriller
65601,Blackrock High Yield Municipal Fund - Class K,Horror|Thriller
65631,MFS International Large Cap Value Fund Cl C,Action|Drama
65642,Target Retirement 2065 Fund Class I,Sci-Fi|Thriller
65660,Nuance Mid Cap Value Fund  Institutional Cl,Drama
65682,Virtus Sga New Leaders Growth Fund Class R6,Action|Fantasy|Horror|Thriller
65685,BNY Mellon New York Amt-Free Municipal Bond Fund,Adventure|Fantasy
65731,Royce Small-Cap Value Fund - Consultant Class,Crime|Mystery|Thriller
65740,Transamerica International Small Cap Value I,Comedy|Romance
65802,VOYA Solution 2060 Port Cl T,Action|Comedy|Crime
65810,CT 529 Divid Growth Portfolio Class P,Drama|Musical
65813,Columbia North Carolina Intermediate Municipal B,Horror|Mystery|Thriller
65866,Goldman Sachs Prime Obligations Fund - Drexel Ha,Crime|Drama
65868,Invesco High Yield Municipal Fund Class Y,Fantasy|Horror|Musical
65882,Eaton Vance Income Fund of Boston - Class R6,Drama|Horror|Mystery|Thriller
65899,Western Asset Short Duration Municipal Income Fu,Comedy|Romance|Sci-Fi|Thriller
65927,Clough Global Opportunities Fund,Action|Mystery|Thriller
65982,Franklin Federal Intermediate-Term Tax-Free Inco,Action|Adventure|Sci-Fi
66015,Blackrock Enhanced Dividend Achievers Trust,Action|Drama|Romance|War
66053,Columbia Select Small Cap Value Fund Class I2,Drama|Mystery
66090,MFS Research Fund Class R3,Horror|Thriller
66097,Wells Fargo Wisconsin Tax-Free Fund Class C,Animation|Fantasy|Thriller
66118,Putnam Short Duration Bond Fund Class C,Documentary
66130,State Street Target Retirement 2030 Fund Class I,Action|Drama
66156,Columbia Disciplined Core Fund Class Adv,Thriller
66171,Franklin Lifesmart 2045 Retirement Target Fund,Sci-Fi|Thriller
66198,Mainstay Large Cap Growth Fund Class R2,Drama|Thriller
66200,Buffalo Small Cap Fund Inc.,Drama|Romance
66203,Baron Small Cap Fund R6 Shares,Comedy|Drama|Romance
66234,Tcw Global Bond Fund Class N,Crime|Drama|Thriller
66240,Principal Fds Inc. International Emerging Marke,Comedy|Fantasy
66297,Blackrock Science & Technology Opportunities Por,Action|Animation|Comedy|Sci-Fi
66310,Metropolitan West Low Duration Bond Fund,Drama|Horror|Thriller
66320,Guidestone Funds Equity Index Fund - Investor Cl,Documentary
66335,Oklahomadream 529 Moderate Growth Portfolio Clas,Animation
66337,Fidelity Sai Short-Term Bond Fund,Drama
66371,American Fds  American High-Income Municipal Bo,Drama
66385,Federated Institutional High Yield Bond Fund Ins,Drama|War
66427,Harbor Bond Fund - Retirement Class,Comedy|Horror
66472,Sgi U.S. Large Cap Equity Fund Class I,Action|Thriller
66509,Jpmorgan Diversified - A,Comedy|Drama
66511,Emerald Growth Fund Inv Cl,Comedy|Drama
66581,Lord Abbett Convertible Fund Class I,Comedy
66596,Royce Premier Fd Insti Cl,Comedy|Crime|Mystery
66639,One Choice Blend+ 2055 Portfolio I Class,Action|Adventure|Sci-Fi|Thriller
66659,Baird Small/Mid Cap Growth Fund Investor Class,Comedy|Crime|Drama
66665,Msif Frontier Markets Portfolio - Class A,Comedy|Drama|Romance
66686,VOYA Index Solution 2025 Portfolio Adviser,Drama|Film-Noir|Thriller
66691,Principal Fds Inc. Principal Lifetime 2050 Fd C,Crime
66744,Arbitrage Fund Class A,Drama
66762,Rydex Series Fds Consumer Products Fund H Class,Comedy|Drama|Romance
66783,Delaware Corporate Bond - R6,Horror
66785,MFS Maryland Municipal Bond Fund Class B,Action|Adventure|Comedy|Western
66798,Columbia Moderate Track Ages 14-15 Class A,Adventure|Comedy|Mystery
66801,Aqr Diversified Arbitrage Fund Class N,Documentary
66808,Capital Group Global Equity Fund Class R-4,Action|Adventure|Drama
66934,Ashmore Emerging Markets Corporate Income Fund -,Comedy|Drama|Musical|Sci-Fi
67073,T. Rowe Price Mid-Cap Index Fund I Class,Horror
67087,Federated Hermes Prime Cash Obligations Fund TR,Comedy
67096,Jpmorgan U.S. Large Cap Core Plus A,Adventure|Drama|Film-Noir|Thriller
67186,Jpmorgan Smartretirement 2030 Class A,Horror|Thriller
67193,Blackrock Hlthsc Op I,Crime|Romance|Thriller
67197,Virtus Rampart Equity Trend Fund Class A,Action|Drama|Mystery|Sci-Fi|Thriller
67223,Neuberger Berman Large Cap Value Fd Inv,Drama
67252,Hartford Moderate Allocation Fund [Class C],Action
67255,Invesco Dividend Income Fd Cl C,Crime|Drama|Mystery|Thriller
67267,City National Rochdale Government Bond Fund Serv,Comedy|Drama
67295,Columbia Small Cap Value Fund I Class I2,Action|Animation|Children|Comedy
67361,Goldman Sachs Tax Advantaged Global Equity Ptf I,Action|Mystery|Thriller
67365,Gabelli Gold Fund Inc. Class I,Comedy|Drama|Romance
67408,Saratoga Advantage TR Health & Biotechnology Fd,Animation|Sci-Fi|IMAX
67422,Metropolitan West Total Return Bd Fd - Admin Cl,Comedy|Drama|War
67508,Eaton Vance Floating-Rate & High Income Fund - C,Action|Crime|Drama|Thriller
67620,World Select Equity Fund Class A,Drama|Thriller
67624,Thrivent Income Fund Class A,Thriller
67665,Eip Growth and Income Fund - Class I,Documentary|Musical
67695,Nuveen Small Cap Value Fund Class R6,Action|Comedy
67706,Guidestone Funds Money Market Fund - Institution,Drama|Film-Noir
67734,One Choice 2060 Portfolio - Investor Class,Comedy|Drama
67748,Vy Clarion Global Real Estate Portfolio  Service,Comedy|Drama|Romance
67788,Pioneer Diversified High Income Trust Fund,Comedy|Romance
67799,Great-West Moderately Conservative Profile II Fu,Drama|Fantasy|Sci-Fi|Thriller
67801,Hotchkis & Wiley Small Cap Value Fund Class Z,Crime|Drama|Romance
67867,Queens Road Small Cap Value Fund,Action|Adventure|Fantasy|Sci-Fi
67888,American Century One Choice 2030 Ptf R Class,Comedy
67892,Delaware Tax-Free New York Fund Inst Cl,Comedy|Musical|Romance
67900,Washington Mutual Investors Fund Class R-3 Share,Horror|Thriller
67923,Large Cap Growth Portfolio Instl Shs,Action|Crime|Drama|Thriller
67997,Columbia Large Cap Value Fund Class C,Comedy
68028,Domini Sustainable Solutions Fund Institutional,Crime|Drama
68044,Tiaa-Cref Short Duration Impact Bond Fund - Prem,Crime|Drama|Film-Noir
68067,VOYA Balanced Income Portfolio Class A,Western
68069,Fidelity Advisor Strategic Real Return Fund - Cl,Western
68073,Fidelity Climate Action Fund,Comedy|Drama
68099,Investment Grade Bond Fund Class Y,Documentary
68135,American High-Income Trust Class 529-F-3,Comedy|Drama
68157,Mainstay Winslow Large Cap Growth Fund Simple Cl,Action|Drama|War
68159,Wilmington U.S. Treasury Money Market Fund Insti,Crime|Drama|Thriller
68194,Lord Abbett Securities TR Lord Abbett Value Opp,Drama
68205,Janus Henderson Global Select Fund - D Shares,Action|Comedy|Crime
68237,Massmutual Select T. Rowe Price Retirement Balan,Drama|Mystery|Sci-Fi|Thriller
68269,Mid-Cap Value Profund Investor Class,Drama|Romance
68288,Invesco Global Responsibility Equity Fund Cl R6,Crime|Drama|Thriller
68319,Tiaa-Cref Lifecycle Index Fd 2055 Premier,Action|Sci-Fi|Thriller
68324,Northern Funds Core Bond Fund,Drama
68347,Grandeur Peak Global Opportunities Fund  Insti C,Crime|Drama|Thriller
68358,Pimco Commodity Realreturn Strategy Fund Class R,Action|Adventure|Sci-Fi|IMAX
68392,Lord Abbett Short Duration Tax Free Fund Class C,Comedy
68442,Goldman Sachs MLP and Energy Renaissance Fund -,Comedy|Drama
68444,Franklin Lifesmart 2025 Retirement Target Fund C,Comedy
68482,Mainstay Growth Allocation Fund Class B,Action|Crime|Mystery|Thriller
68486,Principal Funds Inc. - High Yield Fund Class R,Action|Drama|War
68519,Invesco Technology Fund Class Y,Crime|Mystery|Sci-Fi|Thriller
68522,Natixis Oakmark Internationa Fd Cl C,Documentary
68552,Delaware Limited-Term Diversified Income Fund -,Drama
68554,Dearborn Partners Rising Dividend Fund - Class A,Crime|Drama|Mystery|Thriller
68650,Champlain Small Company Fund,Drama
68659,Invesco Global Real Estate Income Fund Class C,Adventure|Comedy|Drama
68674,Capital World Bond Fund Class R-3 Shares,Drama
68749,Goldman Sachs Long Short Credit Strategies Fund,Comedy|Romance
68791,Eaton Vance Tax-Managed Small-Cap Value Fund - C,Action|Adventure|Sci-Fi|Thriller
68793,Federated Government Reserves Fund - Class B,Action|Comedy|IMAX
68838,Jpmorgan Emerging Markets Equity Fund - R4,Documentary
68843,Blackrock Total Factor Fund - Institutional,Action|Comedy|Horror
68848,John Hancock Diversified Macro Fund Class R6,Adventure|Comedy|Crime|Romance
68858,Tributary Nebraska Tax-Free Fund - Institutional,Drama|Romance
68872,Manning & Napier Fd Inc. High Yield Bond Series,Drama|War
68901,Invesco Peak Retirement 2055 Fund Class Y,Drama
68932,International High Relative Profitability Portfo,Drama|Musical
68941,VOYA Small Company Fund II Cl C,Drama|Horror|Thriller
68952,Hanlon Tactical Dividend and Momentum Fund Class,Comedy|Horror
68954,Clearbridge Small Cap Value Fund Class I,Adventure|Animation|Children|Drama
68959,Invesco Peak Retirement 2030 Fund Class R5,Action|Adventure|Animation|Drama
68963,Invesco Oppenheimer Developing Markets Fund Clas,Comedy|Romance
68967,Msif Global Opportunity Portfolio - Class Ir,Drama
68976,John Hancock Multi-Index 2065 Lifetime Portfolio,Drama|Romance
