movieId,title,genres
3092,Fidelity Managed Retirement 2015 Fund Class K6,Drama
3093,Great-West T. Rowe Price Equity Income Fund Inve,Drama|Western
3094,American Funds - Europacific Growth Fund Class R,Drama|Romance
3095,Pimco Fds Pacific Inv Mgmt Ser Commodityrealre,Drama
3096,MFS Low Volatility Global Equity Fund Cl R1,Comedy
3097,Massmutual Select Growth Opportunities Fund Clas,Comedy|Drama|Romance
3098,Plan Investment Fund Money Market Portfolio,Drama
3099,Ladenburg Aggressive Growth Fund - Class C,Comedy|Drama|Romance
3100,Nationwide Destination 2035 Fd Cl Inst Svc,Drama
3101,Msvif Emerging Mkts Debt Portfolio Class II,Drama|Thriller
3102,Goldman Sachs High Yield Municipal Fd Cl A,Crime|Romance|Thriller
3103,Amg River Road Long-Short Fund Class Z,Drama|Romance
3104,Hartford International Value Fund - Class R6,Action|Comedy|Crime|Thriller
3105,T. Rowe Price High Yield Fd Advisor Cl,Drama|Mystery
3106,1290 Multi-Alternative Strategies Fund Class A,Drama|Romance
3107,Virtus Duff & Phelps Global Real Estate Securiti,Action|Drama
3108,Franklin Maryland Tax-Free Income Fund Class R6,Comedy|Drama|Fantasy|Romance
3109,Western Asset Smash Series TF Fund,Drama
3110,Timothy Plan Aggressive Growth Fund Class C,Drama
3111,Goldman Sachs MLP & Energy Fund - Class C Shares,Drama
3112,MFS Blended Research Emerging Markets Equity Fun,Drama
3113,The Ab Portfolios - Ab Conservative Wealth Strat,Action|Fantasy|Horror|Mystery|Thriller
3114,Franklin Strategic Income Fund Class C,Adventure|Animation|Children|Comedy|Fantasy
3115,MFS Bond Fund Class C,Drama
3117,Eaton Vance Global Macro Absolute Return - Class,Drama|Romance|War
3120,Eaton Vance Parametric Emerging Markets Fund - C,Comedy
3121,Ab Discovery Growth Fund Inc. - Class C,Drama|Film-Noir
3122,Fidelity Intermediate Government Income Fund,Drama|Romance|Western
3125,Massmutual Select T. Rowe Price Retirement 2055,Drama
3126,Rydex Series Fds Inverse S&P 500 Strategy Fund,Drama
3127,BNY Mellon Select Managers Small Cap Value Fund,Comedy|Drama
3128,Tributary Small/Mid Cap Fund - Institutional Plu,Drama
3129,Pimco California Municipal Bond Fund Class I-2,Comedy|Drama
3130,Investec Global Franchise Fund I Shares,Comedy|Crime|Drama
3134,John Hancock Multi-Index 2035 Preservation Portf,Drama|War
3135,Dfa Global Core Plus Fixed Income Portfolio,Drama
3137,Leland Thomson Reuters Private Equity Index Fund,Action|War
3139,Goldman Sachs International Equity ESG Fund - Se,Action|Adventure
3140,Timothy Plan Large/Mid Cap Growth Fund - Class I,Comedy
3141,Invesco Oppenheimer Global Opportunities Fund Cl,Drama
3142,Aberdeen Global Equity Fund Insti Service Class,Documentary|Musical
3143,Fidelity Real Estate Income,Drama|War
3144,Nuveen Real Estate Income Fund,Comedy|Romance
3145,Principal Fds Inc. International Emerging Marke,Drama
3146,Wells Fargo Target 2050 Fund Class R,Comedy
3147,Principal Fds Inc. High Yield Fd Cl A,Crime|Drama
3148,Allianzgi  Nfj  Small-Cap Value Fund Class C,Drama
3149,Valic Company I Inflation Protected Fund,Mystery
3150,Trillium P21 Global Equity Fund Retail Class,Drama|Thriller
3152,Franklin Income 529 Portfolio Cl A,Drama
3153,Massmutual Premier Balanced Fund Service Class,Action|Adventure|Fantasy
3155,Thrivent Money Market Fund Class S,Drama|Romance
3156,Sterling Capital Equity Income Fund Class R6,Drama|Romance|Sci-Fi
3157,Dws Money Market Prime Series - Dws Money Market,Children|Comedy|Fantasy
3158,MFS Municipal Intermediate Fund Cl C,Drama
3159,Columbia Fds Srs TR I U.S. Treasury Index Fund,Animation|Children|Musical|IMAX
3160,Touchstone Global ESG Equity Fund Class A,Drama
3162,Virtus Sga International Growth Fund Class R6,Comedy|Drama
3163,Quantified Market Leaders Fund Investor Class,Comedy|Drama|Musical
3165,Massmutual Premier Global Fund Class A,Action|Drama
3166,American Funds Preservation Portfolio Class R-3,Adventure
3167,Eaton Vance Balanced Fund Class C,Comedy|Drama
3168,Columbia Massachusetts Intermediate Municipal Bo,Adventure|Drama
3169,Mh Elite Small Cap Fund of Funds,Crime|Drama|Thriller
3171,Blackrock Lifepath ESG Index Retirement Fund Cla,Drama
3173,Hartford Schroders Emerging Markets Equity Fund,Drama
3174,Ashmore Emerging Markets Active Equity Fund - Cl,Comedy|Drama
3175,Jpmorgan Smartretirement Blend 2025 Fund - R4,Adventure|Comedy|Sci-Fi
3176,Equity Income Portfolio,Drama|Mystery|Thriller
3177,Blackrock Total Return Fund Class A1,Comedy
3178,Ishares S&P 500 Index Fund - Institutional,Drama
3179,One Choice Blend+ 2065 Portfolio I Class,Drama
3181,Artisan Developing World Fund - Advisor Shares,Drama
3182,Columbia College 529 Port A - Static,Documentary
3183,Pimco Stocksplus International Fund [U.S. Dollar,Drama
3185,Johcm Emerging Markets Small Mid Cap Equity Fund,Drama
3186,Wells Fargo Target Today Fund Admin Class,Drama
3188,Mainstay Mackay Small Cap Core Fund Class A,Documentary
3189,Emerald Insights Fund Class A,Children|Drama
3190,Western Asset Global High Yield Bond Fd Is,Adventure|Sci-Fi|Thriller
3194,City National Rochdale Intermediate Fixed Income,Drama|Romance
3196,American Century One Choice 2030 Ptf A Cl,Drama|War
3197,Massmutual Premier Diversified Bond Fund Service,Action|Crime|Romance|Thriller
3198,John Hancock Freedom 529 Capital Appreciation Po,Crime|Drama
3199,Tiaa-Cref Lifestyle Income Fd Premier,Comedy|Drama|Musical|Romance
3200,Vy American Century Small-Mid Cap Value Portfoli,Comedy|Drama
3201,Janus Henderson Research Fund - T Shares,Drama
3202,Ivy High Income Fund Class R,Drama|Horror
3203,Guggenheim Rbp Large-Cap Market Fund Class P,Thriller
3204,Victory Newbridge Large Cap Growth Fund Class I,Action|Mystery|Thriller
3206,Victory Rs Large Cap Alpha Fund - Class Y,Romance
3207,Hennessy Japan Fd Inst Cl,Adventure
3208,Neuberger Berman High Income Bond Fund Investor,Action|Comedy
3210,MFS Massachusetts Municipal Bond Fund -R6,Comedy|Drama|Romance
3211,American Century Inflation-Adjusted Bond Fund -,Drama
3213,Vanguard Developed Markets Index Investor,Animation|Children
3214,Stit Stic Prime Portfolio Corp Cl,Drama
3217,Invesco Growth and Income Fund Class R5,Drama
3219,Pace Small/Medium Company Value Equity Investmen,Mystery|Thriller
3221,Maryland Short-Term Tax-Free Bond Fund - I Class,Drama
3222,Horizon Active Risk Assist Fund - Investor Class,Drama
3224,Invesco Oppenheimer Global High Yield Fund Class,Drama
3225,John Hancock Funds II Multimanager Lifestyle Gro,Comedy|Romance
3229,Neuberger Berman Global Real Estate Fund Class A,Crime|Drama
3230,John Hancock Global Environmental Opportunities,Thriller
3232,Guggenheim Limited Duration Fund- C Class,Comedy
3235,American Century Large Company Value Investor Cl,Comedy
3238,T. Rowe Price Qm U.S. Value Equity Fund,Thriller
3240,John Hancock Funds II Multimanager 2030 Lifetime,Comedy
3243,Rydex Series Trust Technology Fund Investor Clas,Comedy
3244,Blackrock Lifepath ESG Index Retirement Fund Inv,Comedy|Romance
3245,Baird Short-Term Municipal Bond Fund - Instituti,Drama
3246,Goldman Sachs Short-Term Conservative Income Fun,Drama
3247,Pimco Fds Short-Term Fd Administrative Cl,Comedy|Crime
3248,Delaware Emerging Markets Fund A Class,Comedy
3249,Mainstay Balanced Fund Class R3,Drama|Thriller
3250,Touchstone International Equity Fund Class Y,Drama
3251,James Golden Rainbow Fund Class I,Drama|Mystery
3252,Permanent Portfolio Class I,Drama
3253,Western Assets High Income Fund II,Comedy
3254,Amg GW&K Trilogy Emerging Markets Equity Fund -,Comedy
3255,Ishares Total U.S. Stock Market Index Fund - Cla,Comedy|Drama
3256,Multi-Asset Growth Strategy Fund - Class C,Action|Crime|Drama|Thriller
3257,Goldman Sachs Financial Square Federal Instrumen,Drama|Romance|Thriller
3258,VOYA Solution 2025 Portfolio Adviser,Comedy|Fantasy
3259,Kinetics Mutual Funds Inc. The Paradigm Fund,Adventure|Drama|Romance
3260,Spectrum Low Volatility Fund Investor Class,Drama
3261,Jpmorgan Value Advantage Class L,Comedy|Drama|Romance
3262,VOYA Intermediate Bond Portfolio Service,Crime|Drama|Mystery|Thriller
3263,Goldman Sachs Short Duration Government Fund - I,Comedy|Drama
3264,Queens Road Value Fund,Action|Comedy|Horror
3265,Allianzgi Short Duration High Income Fund R6,Action|Crime|Drama|Thriller
3266,Goldman Sachs Long Short Credit Strategies Fund,Comedy|Crime|Drama|Thriller
3267,Dws Emerging Markets Fixed Income Fund - Class S,Action|Crime|Thriller|Western
3268,Invesco Small Cap Equity Fund Class C,Action|Comedy
3269,Pimco Fds California Intermediate Municipal Bond,Drama|Romance|Sci-Fi
3270,Great-West Aggressive Profile II Fund Institutio,Comedy|Drama|Romance
3271,Fidelity Advisor Asset Manager 40% Class C,Drama
3272,MFS Total Return Fund Class R5,Crime|Drama
3273,Washington Mutual Investors Fund - Class R-5E,Comedy|Horror|Mystery|Thriller
3274,529 WI Tiaa-Cref Small-Cap Blend Index Option Cl,Drama|Thriller
3275,Eagle MLP Strategy Fund Class A,Action|Crime|Drama|Thriller
3276,CBOE Vest S&P 500 Dividend Aristocrats Target IN,Comedy
3281,Pace Alternatives Strategies Investments Class P,Documentary
3282,American Funds Ltd Term Tax-Ex Bond Fd of Americ,Comedy
3284,MFS Research Fund Class B,Comedy|Mystery|Romance
3285,Thrivent Municipal Bond Fund Class S,Adventure|Drama
3286,The Emerging Markets Fund - Class K,Comedy
3287,MFS Global Total Return Fund Class B,Animation|Children
3289,Blackrock International Fund Class R Shares,Drama
3292,Rydex Basic Materials Fund - C Class,Film-Noir
3296,Tiaa-Cref Lifecycle Index 2050 Fund Rtmt,Drama
3298,Parnassus Endeavor Fund - Institutional Shares,Crime|Drama|Thriller
3300,Essential 40 Stock Fund - Class I,Horror|Sci-Fi|Thriller
3301,Eventide Limited-Term Bond Fund - Class I,Comedy|Crime
3302,American Century Select Fund - Y Class,Comedy
3303,Hood River Small-Cap Growth Fund - Retirement Sh,Documentary
3304,Dupree Mutual Funds Intermediate Government Bond,Crime|Drama
3307,Transamerica Multi-Asset Income - Class A,Comedy|Drama|Romance
3308,Chartwell Small Cap Growth Fund,Comedy|Drama
3310,Ab Municipal Income Fund Inc. - High Income Mun,Comedy|Drama
3311,Principal Funds Inc. - Small-Midcap Dividend IN,Western
3313,Resq Strategic Income Fund Class C,Comedy
3316,Invesco Peak Retirement 2015 Fund Class Y,Action|Thriller
3317,Victory Integrity Mid-Cap Value Fund Member Clas,Comedy|Drama
3318,Fidelity Advisor Series I Fidelity Advisor Divid,Drama|Thriller
3320,Columbia Overseas Value Fund Class Adv,Comedy|Drama|Romance
3324,Dfa International Value Portfolio III,Comedy
3325,First Eagle U.S. Value Fund Class R3,Comedy|Drama
3326,John Hancock Funds II Alternative Asset Allocati,Comedy|Sci-Fi
3327,Allianzgi Nfj Large-Cap Value Fund Institutional,Documentary
3328,MFS Lifetime 2055 Fd Cl I,Crime|Drama
3329,Touchstone Small Cap Value Fd Insti Cl,Drama
3330,Delaware Minnesota High Yield Municipal Bond Fun,Drama|Romance
3331,Federated Hermes Treasury Obligations Fund Insti,Drama
3333,Fidelity Advisor Freedom Blend 2065 Fund Class M,Drama
3334,Calamos Timpani Smid Growth Fund Class R6,Crime|Drama|Film-Noir|Thriller
3338,Jpmorgan Hedged Equity Fund - C,Documentary
3339,Manning & Napier Fd Real Estate Series Class I,War
3340,The Gabelli Global Financial Services Fund Class,Horror|Sci-Fi
3341,Blackrock Lifepath Dynamic 2060 Fund - Class A,Comedy
3342,Amg GW&K Municipal Bond Fund - Class N,Drama|War
3343,Vy Clarion Global Real Estate Portfolio  Adviser,Comedy|Drama|Romance
3345,Massmutual Retiresmart Moderate Growth Fund Clas,Adventure|Children
3347,Columbia Aggressive Track Ages 10-11 Class C,Adventure|Drama
3350,MFS Limited Maturity Fund Class I,Drama
3354,Johcm Global Income Builder Fund Class II,Sci-Fi
3355,Rational/Pier 88 Convertible Securities Fund Cl,Fantasy|Horror|Mystery|Thriller
3357,Neuberger Berman Global Allocation Fd Cl A,Drama|Romance
3358,Longleaf Partners Small Cap Fund,Comedy|Drama|Fantasy|Romance
3359,Goldman Sachs Real Estate Diversified Income Fun,Comedy|Drama
3360,Resq Strategic Income Fund Class A,Drama|Romance
3361,VOYA Target Retirement 2040 Fd Cl A,Comedy|Drama|Romance
3362,Columbia Global Opportunities Fund Class I,Crime|Drama
3363,BNY Mellon Dynamic Value Fund Class C,Comedy|Drama
3364,Lord Abbett Intl Opportunities Fd - Cl F,Crime|Film-Noir
3365,Oklahomadream 529 Asset Manager 60% Portfolio Cl,Drama|Western
3368,Clarkston Partners Fund. Institutional Class,Romance|Western
3370,Palmer Square Income Plus Fund,Drama|Thriller
3371,Wasatch Micro Cap Value Fund Institutional Class,Drama
3372,The International Equity Fund - Share Class 2,Action|War
3373,Pimco Inflation Response Multi-Asset Fd Insti,Western
3374,Riverfront Dynamic Equity Income Fd Cl C,Drama
3375,Columbia Disciplined Growth Fund Class Adv,Sci-Fi
3377,American Beacon Frontier Markets Income Fund - Y,Drama|War
3379,Nationwide Ziegler NYSE Arca Tech 100 Index Fund,Drama
3380,American Funds Conservative Growth and Income Po,Film-Noir
3384,Franklin Federal Tax Free Income Fund Class C,Action|Crime
3385,The Income Fund of America Class A Shares,Comedy
3386,MFS Aggressive Growth Allocation Fund Class R1,Drama|Mystery|Thriller
3387,Invesco Oppenheimer Discovery Fund Class R5,Comedy|Mystery
3388,American Fds 2040 Target Date Retirement Fd Cl R,Children|Comedy
3390,Delaware Small Cap Core Fund Class R,Adventure|Crime|Drama|Romance
3391,Invesco Municipal Income Fd Cl C,Comedy
3392,Lord Abbett Total Return Fund Class R5,Comedy
3393,Ab Municipal Income Fund Inc. - National Portfo,Comedy|Fantasy|Romance
3394,Massmutual Retiresmart 2030 Fund Class R3,Comedy|Romance
3395,Jpmorgan Unconstrained Debt Fund I Class,Comedy
3396,The Growth Fund of America Class A Shares,Adventure|Children|Comedy|Musical
3397,Sei Asset Allocation TR Market Growth Strategy,Children|Comedy
3398,Invesco Oppenheimer Emerging Markets Local Debt,Children|Comedy|Musical
3399,Fidelity Advisor Freedom Blend 2065 Fund Class Z,Children|Comedy
3400,Nebraska Municipal Fund Class I,Adventure|Animation|Children|Fantasy
3401,Brookfield Real Assets Securities Fund - Class C,Adventure|Sci-Fi
3402,Blackrock Low Duration Bond Portfolio - Class K,Comedy|Drama|Romance
3403,Tiaa-Cref Large-Cap Value Index Fund - Class W,Drama|Thriller
3404,One Choice Blend+ 2040 Portfolio R6 Class,Action|Drama
3405,First Eagle Global Fund Class I,Action|Drama
3406,Carillon Eagle Growth & Income Fund Class C,Action|Adventure|Drama|War
3408,Fidelity Advisor Sustainability U.S. Equity Fund,Drama
3409,Invesco Short Duration High Yield Muni Fund Clas,Drama|Thriller
3412,Third Avenue Real Estate Value Fd Insti Class,Adventure|Children|Drama
3413,American Century Focused International Growth Fu,Crime|Drama
3414,Lazard International Compounders Portfolio Open,Drama|Romance|War
3415,Prudential Day One 2035 Fund Class R1,Drama
3417,Villere Balanced Fund,Adventure|Comedy
3418,The Hartford Emerging Markets Local Debt Fd Cl Y,Adventure|Crime|Drama
3420,Fidelity Advisor Freedom Blend 2065 Fund Class I,Drama|Thriller
3421,Alps/Smith Total Return Bond Fund Class C,Comedy
3422,Fpa Queens Road Small Cap Value Fund Advisor Cla,Comedy|Romance
3423,Jpmorgan Smartretirement 2020 Fund I Class,Drama
3424,Eaton Vance Emerging Markets Debt Opportunities,Drama
3425,Tiaa-Cref S&P 500 Index Fund - Class W,Drama|Musical
3426,Goldman Sachs Financial Square Treasury Obligati,Drama|Romance
3427,VOYA Russell Mid Cap Index Portfolio Adviser,Crime
3428,Victory Munder Mid-Cap Core Growth Fund - Class,Drama
3429,Dws Tax-Exempt Portfolio Dws Tax-Exempt Money F,Animation|Comedy
3430,Tiaa-Cref Lifecycle 2060 Fund - Advisor,Action|Crime|Drama
3431,Calvert U.S. Large Cap Core Responsible Index Fu,Action|Drama
3432,Goldman Sachs Blue Chip Fund Institutional Share,Action|Drama
3433,Sterling Capital Special Opportunities Equity Fu,Action|Drama
3434,Columbia Bond Fund Class A,Action|Drama
3435,John Hancock Funds II Multimanager 2040 Lifetime,Crime|Drama|Film-Noir
3436,New World Fund Inc. Class F-2 Shs,Drama|Romance
3437,Pimco Stocksplus Short Fund Class Instl,Drama
3438,Wells Fargo National Tax Free Money Market Class,Action|Children|Comedy|Fantasy|Sci-Fi
3439,Morgan Stanley Tax-Free Daily Income Trust - S C,Action|Children|Fantasy
3440,VOYA Target Retirement 2055 Fd Cl A,Action|Adventure|Children|Comedy|Fantasy
3441,Franklin Moderate Allocation Age Newborn 4 Years,Action|Drama|War
3442,Wf Asset Allocation Fund Class R,Action|Crime|Drama
3443,Cambiar Opportunity Fund Portfolio Investor Clas,Action|Drama|Thriller
3444,Fidelity Advisor Ser Vii,Action
3445,Victory Incore Low Duration Bond Fund - Class R,Mystery|Thriller
3446,Transamerica Cleartrack Retirement Income Class,Comedy|Drama
3447,State Street Small/Mid Cap Equity Index Portfoli,Drama
3448,VOYA Retirement Moderate Growth Portfolio Initia,Comedy|Drama|War
3449,Janus Henderson Contrarian Fund - I Shares,Drama
3450,S&P 500 Index Fund Class S,Comedy
3451,Blackrock Advantage U.S. Total Market Fund - Cla,Drama
3452,US High Dividend Low Volatility Fund Class P3,Action|Crime|Romance|Thriller
3453,UBS Select ESG Prime Institutional Fund,Drama|Romance
3454,Lord Abbett Total Return Fd - Cl F,Comedy|Romance
3456,Mercer Core Fixed Income Fund Class Y-3,Drama
3457,BNY Mellon High Yield Fund Class I,Drama|Thriller
3459,Goldman Sachs Blue Chip Fund Class P Shares,Drama|Horror
3461,American Century Global Gold Investor Class,Adventure|Drama|Thriller
3462,American Funds Mortgage Fund Class A,Comedy|Drama|Romance
3466,Kinetics Mutual Funds Paradigm Fund Advisor Cla,Comedy|Fantasy
3467,Alphacentric Symmetry Strategy Fund Class I,Drama|Western
3468,Wells Fargo Target 2030 Fund Class R6,Drama
3469,American Funds U.S. Govt Securities C [Income Se,Drama
3470,Goldman Sachs Financial Square Federal Instrumen,Adventure|Drama
3471,Msif International Advantage Portfolio Class A,Adventure|Drama|Sci-Fi
3473,Columbia Conservative Track Ages 10-11 Class C,Comedy
3474,Goldman Sachs Multi-Manager Alternatives Fd Cl R,Sci-Fi|Thriller
3475,Dfa Emerging Markets Value Ptf Class R2,Drama|Romance
3476,Goldman Sachs Target Date 2030 Portfolio Institu,Horror|Mystery
3477,Mirova U.S. Sustainable Equity Fund Class N,Comedy|Drama
3478,Profunds Ultra Short Dow 30 Profund Investor Cla,Drama
3479,Franklin High Yield Tax-Free Income Fund Cl A,Adventure|Fantasy|Romance
3480,Goldman Sachs Financial Square Federal Instrumen,Drama|Romance
3481,Touchstone International Equity Fund Class C,Comedy|Drama|Romance
3483,BNY Mellon Short-Intermediate Municipal Bond Fun,Animation|Children
3484,X-Square Balanced Fund Cl A,Thriller
3487,The Hartford Conservative Allocation Fund Class,Western
3489,Nuveen Symphony High Yield Income Fund Class R6,Adventure|Comedy|Fantasy
3490,Jpmorgan Mid Cap Value Fund-R3,Horror
3491,The Merger Fund Institutional Cl,Comedy
3492,Janus Henderson Contrarian Fund - C Shares,Adventure|Comedy|Romance
3494,Columbia Tax-Exempt Fund Class Adv,Adventure|Drama|Western
3496,Dws European Equity Fund - Class C,Drama
3497,Davis International Fund Class A,Comedy
3498,Franklin California Intermediate-Term Tax-Free I,Drama
3499,Western Asset Global High Yield Bond Fund Class,Drama|Horror|Thriller
3500,Principal Fds Inc. Principal Lifetime 2030 Fd C,Comedy|Drama
3501,Ave Maria Rising Dividend Fund,Comedy|Romance
3502,Mainstay Moderate Allocation Fund Class A,Drama
3503,Johnson Core Plus Bond Fund,Drama|Mystery|Sci-Fi
3504,Franklin Income Fund Class C,Comedy|Drama
3505,Neuberger Berman Guardian Fund Insti Class,Drama|Mystery|Thriller
3506,Destinations Core Fixed Income Fund - Class I,Comedy|Drama
3507,Usaa Value Fund Adviser Shs,Comedy
3508,T. Rowe Price New Horizons Fund Z Class,Action|Adventure|Drama|Thriller|Western
3510,Jpmorgan Tax-Free Bond Fund Class A,Drama|Thriller
3512,Fidelity Advisor Asset Manager 30% Class C,Drama|Romance
3513,Goldman Sachs Clean Energy Income Fund Class P S,Drama|Thriller
3515,Fidelity Advisor Freedom Blend 2050 Fund Class A,Comedy|Romance
3516,Principal Fds Inc. Midcap Growth Fd Cl R-3,Comedy|Fantasy|Romance
3518,Fidelity Advisor Gold Fund Class C,Drama|Thriller
3519,Dws ESG Global Bond Fund Institutional Class,Action|Drama|War
3520,Pimco Fds Total Return Fd Cl A,Comedy
3521,Union Street Partners Value Fund Class A Shares,Comedy|Drama
3524,SSGA International Stock Selection Fund Class I,Comedy|Romance
3525,Goldman Sachs Financial Square Treasury Obligati,Comedy
3526,Goldman Sachs Target Date 2050 Portfolio Service,Comedy|Drama
3527,Delaware Strategic Income Fund Institutional Cla,Action|Sci-Fi|Thriller
3528,Cavanal Hill U.S. Treasury Select Share Class,Drama|Romance
3529,Jpmorgan Small Cap Core Fund - R6,Crime|Thriller
3531,Sterling Capital Short Duration Bond Fund Cl C,Comedy|Drama|Romance
3534,Amg GW&K Trilogy Emerging Wealth Equity Fund  -,Drama
3535,Fidelity Aggressive International Fund,Crime|Horror|Mystery|Thriller
3536,Templeton Dragon Fund  Inc.,Comedy|Drama|Romance
3537,MFS Prudent Investor Fund- Class R2,Comedy|Drama
3538,Western Asset Inflation Indexed Plus Bond Fund,Comedy
3539,Goldman Sachs Target Date 2030 Portfolio Service,Documentary
3540,Invesco Oppenheimer International Growth Fund Cl,Drama|Mystery|Romance
3543,West Loop Realty Fund-Class I,Comedy|Drama
3545,Meridian Growth Fund - Class A Shares,Drama|Musical
3546,Principal Fds Inc. Principal Lifetime 2020 Fd C,Drama|Horror|Thriller
3547,Union Street Partners Value Fund Advisor Class,Comedy|Drama
3548,Goldman Sachs International Equity ESG Fund - Cl,Comedy|Drama
3549,Catholic Investor Long/Short Equity I Shares,Comedy|Musical|Romance
3550,Guidestone Funds Global Real Estate Securities F,Horror
3551,Principal Funds Inc. - Real Estate Securities F,Crime|Drama|Thriller
3552,Pacific Funds Floating Rate Income - Advisor Cla,Comedy
3553,Allianzgi Nfj Mid-Cap Value  Fund Class A,Drama|Thriller
3554,Tekla World Healthcare Fund,Drama|Romance
3555,MFS International Diversification Fund Class I,Action|Thriller|War
3556,Goldman Sachs Investor Money Market Fund Class S,Drama|Romance
3557,American Century Short-Term Government Fd - C Cl,Mystery|Thriller
3559,Acr International Quality Return [Iqr] Fund - Cl,Comedy|Drama|Romance
3564,MFS Technology Fund Class R1,Children|Comedy
3565,Ariel Focus Fund Investor Cl,Comedy|Drama
3566,Invesco Oppenheimer Portfolio Series,Comedy|Drama
3567,Fidelity Freedom Index 2055 Fund Premier Class,Comedy|Drama|Romance
3569,Transamerica Large Cap Value Class C,Comedy|Drama
3571,Federated Capital Income Fund Class A Shares,Comedy|Drama
3572,USA Mutuals Vice Fund-Class C,Horror|Sci-Fi
3573,Brookfield Global Listed Infrastructure Fund Cla,Horror|Sci-Fi
3574,Eaton Vance Tabs 10-To-20 Year Laddered Municipa,Horror|Sci-Fi
3576,Rising Rates Opportunity 10 Profund Service Clas,Action|Horror|Sci-Fi
3577,Equity Income Fund - Class S,Drama|Romance
3578,Fa 529 Value Strategies Port-Cl A,Action|Adventure|Drama
3580,Pimco California Intermediate Municipal Bond Fun,Drama
3581,MFS Series Trust V  - MFS Research Fund Class I,Comedy
3584,Ultralatin America Profund - Service Cl,Action|Drama|Romance|Thriller
3585,Boston Trust Asset Management Fund,Adventure|War
3588,Usaa Government Securities Fund Institutional Sh,Crime|Drama
3590,Morgan Stanley Institutional Fund Inc. - Emergin,Comedy|Drama
3591,John Hancock Multi-Index 2030 Preservation Portf,Comedy|Drama
3593,John Hancock Funds II Multimanager Lifestyle Bal,Action|Sci-Fi
3594,1290 Gamco Small/Mid Cap Value Fund Class T,Drama|Musical
3596,Morgan Stanley Insti Liq Fds Government Securit,Comedy
3597,Amg GW&K Enhanced Core Bond Fund- Class I,Comedy
3598,Jpmorgan Smartretirement 2045 Fund - R3,Crime|Drama|Romance|Thriller
3599,Fidelity Advisor International Small Cap Opportu,Comedy|Musical
3600,Principal Fds Inc. Smallcap Fund Class R-3,Comedy|Musical
3604,Jpmorgan Floating Rate Income Fd A,Musical
3605,Sei Insti Mgd TR Large Cap Fund Class F,Crime|Drama|Musical
3606,Thornburg Developing World Fund Class R6,Comedy|Musical|Romance
3608,Icon Information Technology Fund Class A,Adventure|Comedy
3610,Q3 All-Weather Sector Rotation Fund Investor Cla,Drama|Musical|Romance
3611,WCM Small Cap Growth Fund Investor Class,Animation|Children|Comedy
3612,Carillon Eagle Small Cap Growth Fund Class A,Adventure|Musical|Romance
3613,Fidelity Capital Trust Capital Appreciation Pt.,Comedy
3614,Maingate MLP Fund Class I,Comedy|Romance
3615,Fidelity Advisor Financial Services Fund,Adventure|Animation|Children
3616,MFS New Discovery Value Fd Cl R1,Comedy|Romance
3617,Touchstone Flexible Income Fd Cl Y,Comedy
3618,Nationwide Investor Destinations Moderate Class,Comedy|Crime
3619,Principal Funds Inc. Overseas Fd Cl R-3,Comedy
3620,American Fds 2050 Target Date Retirement Fd Cl R,Comedy|Drama
3621,Fidelity Advisor International Small Cap Class A,Drama|Horror
3622,Dws Large Cap Focus Growth Fund - Class A,Comedy
3623,Federated Kaufman Large Cap Fund R,Action|Adventure|Thriller
3624,Direxion Monthly 7-10 Year Treasury Bear 2X Fund,Action|Adventure|Comedy|Western
3627,Goldman Sachs Financial Square Government Fund -,Horror|Thriller
3628,Amg GW&K Core Bond Fund - Class N,Action|Drama|Romance|War
3629,T. Rowe Price Science & Technology Fund - I Clas,Adventure|Comedy|Romance
3633,Columbia Adaptive Risk Allocation Fund Class I,Action|Adventure|Romance|Thriller
3634,Sterling Capital Behavioral Large Cap Value Equi,Thriller
3635,Cohen & Steers Global Infrastructure Fund Inc Cl,Action|Adventure|Thriller
3638,Columbia Income Opportunities Fund Class Adv,Action|Adventure|Sci-Fi|Thriller
3639,VOYA Balanced Portfolio Service,Action|Adventure|Thriller
3640,Franklin Dynatech Fund Class Advisor,Comedy|Drama
3643,MFS Blended Research Core Equity Fund Class B,Action|Drama|War
3644,Highland Long/Short Healthcare Fund Class A,Western
3645,Hartford Mid Cap Hls Fund Class Ib,Drama
3646,Great-West Government Money Market Fund Investor,Comedy
3649,Franklin Lifesmart Retirement Income Fund Class,Drama
3653,Victory Floating Rate Fund - Class R,Documentary
3654,John Hancock Short Duration Bond Fund Class C,Action|Adventure|Drama|War
3655,Harding Loevner Global Equity Portfolio - Instit,Drama
3658,Lord Abbett Micro Cap Growth Fund Cl C,Horror|Sci-Fi
3660,Jpmorgan Growth Advantage Fund-R3,Horror|Sci-Fi|Thriller
