movieId,title,genres
1,Federated Strategic Value Dividend Fund Class A,Adventure|Animation|Children|Comedy|Fantasy
2,Franklin U.S. Government Money Fund Class R,Adventure|Children|Fantasy
3,Fidelity Small Cap Enhanced Index Fund,Comedy|Romance
4,Franklin Utilities Series Fund - Class R,Comedy|Drama|Romance
5,Columbia Aggressive Track Ages 0-3 Class C,Comedy
6,Blackrock Total Factor Fund - Class K,Action|Crime|Thriller
7,Oklahomadream 529 Portfolio 2034 Class P,Comedy|Romance
8,Fidelity Value Discovery Fund Class K,Adventure|Children
9,Lkcm Fixed Income Fund,Action
10,Ironclad Managed Risk Fund,Action|Adventure|Thriller
11,Invesco Conservative Allocation Fund Class R6,Comedy|Drama|Romance
12,Eventide Healthcare & Life Sciences Fd Cl A,Comedy|Horror
13,The Hartford Short Duration Fd Cl R3,Adventure|Animation|Children
14,Janus Henderson Research Fund - R Shares,Drama
15,Woman IN Leadership U.S. Equity Portfolio,Action|Adventure|Romance
16,Massmutual Premier Diversified Bond Fund Class I,Crime|Drama
17,Hartford Municipal Income Fund Class F,Drama|Romance
18,Neuberger Berman Emerging Markets Equity Fd Inst,Comedy
19,Invesco Equity and Income Fund Class Y,Comedy
20,Pimco Funds Short-Term Fund Class C,Action|Comedy|Crime|Drama|Thriller
21,Fidelity Freedom Blend 2025 Fund,Comedy|Crime|Thriller
22,Vy Jpmorgan Mid Cap Value Portfolio S2,Crime|Drama|Horror|Mystery|Thriller
23,Jpmorgan Small Cap Value Fund R6,Action|Crime|Thriller
24,Wells Fargo Real Return Fund-I,Drama|Sci-Fi
25,Strategic Income Fund - Investor Class,Drama|Romance
26,Federated Short-Intermediate Duration Municipal,Drama
27,MFS Conservative Allocation Fund Class R1,Children|Drama
28,Blackrock College 2035 Option Class I,Drama|Romance
29,Vanguard Small Cap Index Fd Admiral Shs,Adventure|Drama|Fantasy|Mystery|Sci-Fi
30,Nationwide Fund Class C,Crime|Drama
31,The Investment Company of America Class F-2 Shs,Drama
32,Massmutual Retiresmart 2025 Fund Class R3,Mystery|Sci-Fi|Thriller
33,Polen Capital Global Growth Fund- Institutional,Adventure|Romance|IMAX
34,The Hartford Conservative Allocation Fund Class,Children|Drama
35,PGIM Jennison Growth Fund Class R2,Drama|Romance
36,Neuberger Berman International Small Cap Fund Cl,Crime|Drama
39,Ab Bond Fund Inc. - Ab Limited Duration High IN,Comedy|Romance
40,First American Money Market Fund Treasury Obliga,Drama
41,Principal Fds Inc. Bond Market Index Fund Class,Drama|War
42,Oklahomadream 529 Portfolio 2037 Class I,Action|Crime|Drama
43,Ivy Science and Technology Fund Class R,Drama
44,Delaware High-Yield Opportunities Fund Instituti,Action|Adventure|Fantasy
45,Goldman Sachs Large Cap Value Insights Fund Clas,Comedy|Drama|Thriller
46,Lord Abbett Multi-Asset Balanced Opportunity Fun,Drama|Romance
47,Ab Cap Fund Inc. - Ab Emerging Markets Multi-As,Mystery|Thriller
48,Massmutual Select Mid-Cap Value Fund Class I,Animation|Children|Drama|Musical|Romance
49,Goldman Sachs Global Income Fund Institutional S,Drama|Romance
50,Wf Emerging Markets Equity Income Fund Class A,Crime|Mystery|Thriller
52,PGIM Jennison Global Opportunities Fund Class R2,Comedy|Drama|Romance
53,The Gabelli Dividend Growth Fd Class A,Adventure|Drama
54,Federated Capital Reserves Fund,Children|Comedy
55,VOYA Balanced Income Portfolio Class S2,Drama
57,MFS Global Real Estate Fund - Class R2,Drama
58,Fidelity Advisor Utilities Fund,Comedy|Drama|Romance
59,BNY Mellon Global Equity Income Fund Class I,Drama|Mystery
60,Invesco Peak Retirement 2010 Fund Class R6,Adventure|Children|Fantasy
61,American Beacon Shapiro Equity Opportunities Fun,Drama|Thriller
62,PGIM Muni High Income Fund Class R6,Drama
63,HSBC U.S. Treasury Money Market Fd Cl I Shs,Comedy|Crime
64,MFS Managed Wealth Fund - Class R6,Comedy|Romance
65,City National Rochdale Municipal High Income Fun,Comedy
66,Guidestone Funds Global Bond Fund - Investor Cla,Action|Sci-Fi|Thriller
68,US Government Money Market Fund RBC Insti Class,Comedy|Romance
69,Ab Bond Fund Inc. - Ab Municipal Bond Inflation,Comedy
70,Principal Fds Inc. Core Plus Bond Fund Class R,Action|Comedy|Horror|Thriller
71,Tiaa-Cref Lifecycle Index 2010 Fund - Advisor,Action
72,Usaa Government Securities Fund R6 Shares,Comedy|Drama
73,John Hancock Funds II Multimanager 2060 Lifetime,Drama|War
74,Nuveen High Yield Municipal Fd Cl C,Drama|Romance
75,Dws Short Duration Fund - Class Institutional,Comedy|Drama
76,First Eagle Overseas Fund Class R6,Action|Sci-Fi|Thriller
78,Jpmorgan Global Bond Opportunities Fund I Class,Action|Crime|Drama|Thriller
79,Ivy Proshares S&P 500 Dividend Aristocrats Index,Drama|Thriller
80,Principal Funds Inc. - Smallcap Fund Class R6,Children|Drama
81,Steward Large Cap Core Fund Class Institutional,Crime|Drama|Romance
82,MFS Strategic Income Fund,Comedy|Drama
83,Loomis Sayles International Growth Fund Class N,Drama|Romance
84,American Century Ultra Fund R6 Cl,Comedy|Drama
85,Columbia South Carolina Intermediate Municipal B,Drama|Romance
86,Invesco Oppenheimer Global Opportunities Fund Cl,Action|Adventure|Drama
87,Counterpoint Tactical Income Fund Class I,Children|Comedy
88,Federated Total Return Bond Fund-C,Comedy
89,Jpmorgan Hedged Equity 3 Fund Cl A,Action|Thriller
90,Invesco Oppenheimer Steelpath MLP Select 40 Fund,Drama
92,Rydex Series Trust Retailing Fund Investor Class,Drama|Horror|Thriller
93,Neuberger Berman Large Cap Value Fd Cl R3,Comedy|Horror|Romance
94,Natixis Sustainable Future 2020 Fund Class N,Comedy|Drama|Romance
95,Goldman Sachs Government Income Fund Institution,Action|Adventure|Thriller
96,Pimco Long-Term Credit Bond Fund Class I-2,Comedy|Drama
97,Guidemark Large Cap Core Fund Service Shares,Crime|Drama
100,Thrivent Moderately Conservative Allocation Fund,Drama|Thriller
101,The Income Fund of America Class 529-F-2,Adventure|Comedy|Crime|Romance
102,Red Cedar Short Term Bond Fund Institutional Cla,Comedy
103,Equable Shares Hedged Equity Fund Class I,Mystery|Sci-Fi|Thriller
104,Amg GW&K Core Bond Fund - Class Z,Comedy
105,Securian Am Dynamic Managed Volatility Fund,Drama|Romance
107,Fidelity Stock Selector Small Cap Fund Class Z,Adventure|Children|Comedy|Musical
108,Thomas White International Fund I Class,Documentary
110,Touchstone Mid Cap Growth Fund Class C,Action|Drama|War
111,Artisan Select Equity Fund Investor Shares,Crime|Drama|Thriller
112,Transamerica Small Cap Growth Class C,Action|Adventure|Comedy|Crime
113,Massmutual Premier Inflation-Protected and Incom,Drama|Mystery
114,Hcm Dividend Sector Plus Fund - Investor Class S,Drama
115,CT 529 Equity Income Portfolio Class I,Comedy
116,T. Rowe Price Summit Municipal Intermediate Fund,Documentary
117,529 WI VOYA High Yield Bond Option Cl C,Crime|Drama
118,American Independence Kansas Tax-Exempt Bond Fun,Comedy|Romance
121,Lord Abbett Focused Growth Fund - Class R4,Drama
122,John Hancock Funds II Capital Appreciation Fund,Comedy|Romance
123,MFS Lifetime 2045 Fund - Class R5,Drama|Mystery|Romance
124,Columbia Moderate Track Ages 4-5 Class Ag,Drama
125,Fidelity Advisor Multi-Asset Income Fund,Comedy
126,Fidelity Managed Retirement 2030 Fund Class I,Adventure|Children|Fantasy
129,Morningstar Defensive Bond Fund,Comedy|Romance
131,Pimco Senior Floating Rate Fund Class I-2,Drama|Romance
132,Morgan Stanley Institutional Fund Trust Ultra-Sh,Thriller
135,Mirova Global Sustainable Equity Fund Class N,Comedy
137,Prudential Day One 2045 Fund Class R1,Documentary
138,Blackrock Lifepath ESG Index 2030 Fund Instituti,Drama
140,Fidelity Advisor Freedom Blend 2045 Fund Class A,Drama|Romance
141,Catholic Investor Core Bond Fund S Shares,Comedy
144,Goldman Sachs Managed Futures Strategy Fd Inst C,Comedy
145,Horizon Active Risk Assist Fund - Advisor Class,Action|Comedy|Crime|Drama|Thriller
146,Lazard International Equity Portfolio R6 Shs,Adventure|Children
147,Pimco Stocksplus Absolute Return Fund Class I-3,Drama
149,Sei Asset Allocation TR Moderate Strategy Fund,Crime|Drama|Thriller
150,Fidelity Equity Dividend Income Fd,Adventure|Drama|IMAX
151,First American Mm Fds Treas Obligations Corp TR,Action|Drama|Romance|War
152,Loomis Sayles Growth Fund Class C,Drama|Horror
153,Catalyst/Lyons Tactical Allocation Fd Cl A,Action|Adventure|Comedy|Crime
154,Amg Fq Global Risk-Balanced Fund - Class I,Drama
155,Davis New York Venture Fund Inc. Class Y,Adventure|Drama|War
156,Sterling Capital Corporate Fd Cl C,Comedy|Drama
157,Mainstay Mackay Convertible Fund Class I,Comedy|War
158,Guggenheim Total Return Bond Fund- Institutional,Adventure|Children
159,Wf Omega Growth Fund Institutional Class,Crime|Drama|Mystery
160,UBS Total Return Bond Fund Class A,Action|Adventure|Mystery|Sci-Fi
161,Neuberger Berman Real Estate Fund Insti Class,Drama|Thriller|War
162,John Hancock Funds II Multi-Index 2050 Preservat,Documentary
163,Mm S&P 500 Index Fund Class A,Action|Romance|Western
164,Fidelity Advisor Freedom Blend 2040 Fund Class Z,Crime|Film-Noir|Mystery|Thriller
165,Invesco Greater China Fund Cl A,Action|Crime|Thriller
166,Driehaus Small Cap Growth Fund Institutional Sha,Comedy|Crime|Drama
168,Catalyst Enhanced Income Strategy Fund Class C,Action|Drama|Romance
169,American Funds Emerging Markets Bond Fund Class,Adventure|Children|Drama
170,Victory Incore Total Return Bond Fund Class R6,Action|Adventure|Crime|Thriller
171,BNY Mellon Appreciation Fund Inc. Class I,Comedy|Drama
172,Pimco Income Strategy Fund,Action|Sci-Fi|Thriller
173,Jpmorgan Short Duration Bond C,Action|Crime|Sci-Fi
174,Vanguard S&P Midcap 400 Value Index Fd Insti Cl,Comedy
175,Baron Health Care Fund Retail Shares,Drama
176,Investor Tax-Exempt Money Market Fund - Fst Sele,Comedy
177,Victory Rs Growth Fund - Class Y,Horror
178,American Funds Multi-Sector Income Fund Class R-,Comedy|Drama
179,Fiera Capital Small/Mid-Cap Growth Fund - Instit,Drama|Romance
180,Jpmorgan Prime Money Market Fund Capital Shares,Comedy|Romance
181,Goldman Sachs Target Date 2055 Portfolio Service,Action|Children
182,Mainstay U.S. Government Liquidity Fund,Drama|Romance
183,Ab Large Cap Growth Fund Inc. - Class R,Comedy|Horror|Thriller
184,Fidelity Advisor Multi-Asset Income Fund,Drama
185,Destra Granahan Small Cap Advantage Fund Class A,Action|Crime|Thriller
186,Fidelity Series Large Cap Stock Fund,Comedy|Romance
187,Wells Fargo Growth Fund Class C,Comedy
188,1919 Maryland Tax-Free Income Fund Cl I,Fantasy|Horror|Mystery
190,Blackrock Science and Technology Trust II,Thriller
191,Allianzgi Convertible Fund Class A,Drama|Romance
193,Invesco U.S. Government Money Portfolio Cl C,Drama
194,Fidelity Minnesota Municipal Income Fund,Comedy|Drama
195,The New Economy Fund Class 529-A Shares,Comedy|Drama|Romance
196,Invesco Peak Retirement 2015 Fund Class A,Horror|Sci-Fi
198,Goldman Sachs Real Estate Securities Fund Class,Action|Crime|Drama|Mystery|Sci-Fi|Thriller
199,PGIM US Real Estate Fund Class C,Drama|Musical|Romance
200,Federated Prudent Bear Fund - C,Thriller
201,Retail Prime Obligations Fund Class A,Drama|Fantasy
202,Eventide Core Bond Fund Cl C,Drama|Romance
203,Calamos Convertible and High Income Fund,Comedy
204,Loomis Sayles Core Plus Bond Fd Cl N [Tr I],Action
205,Lord Abbett Inflation Focused Fund Class R5,Comedy|Drama
206,Columbia Select Large Cap Growth Fund Class Adv,Documentary
207,Templeton Growth Fund - Class R,Drama|Romance
208,Fidelity Freedom Blend 2035 Fund Class K6,Action|Adventure|Sci-Fi
209,Western Asset Short Duration Municipal Income Fu,Drama
210,Massmutual Premier Core Bond Fund Class R5,Western
211,Jpmorgan Total Return Fund R2,Drama
212,Columbia Conservative Track Ages 6-7 Class C,Adventure|Comedy|Crime|Mystery
213,MFS California Municipal Bond Fund - Class I,Drama
214,Blackrock Fds All-Cap Energy & Resources Ptf IN,Drama|War
215,Usaa Mutual Fds TR Virginia Bond Fund,Drama|Romance
216,Natixis Sustainable Future 2060 Fund Class N,Comedy
217,The Community Development Fund Class A,Drama|Thriller
218,Franklin Lifesmart 2035 Retirement Target Fund C,Comedy|Drama
219,Segall Bryant & Hamill International Small Cap F,Drama
220,Tiaa-Cref Lifecycle 2015 Fund Institutional Clas,Horror
222,Target 2035 Fund - I Class,Drama|Romance
223,MFS New Discovery Fund Cl  R2,Comedy
224,John Hancock Emerging Markets Equity Fund Class,Comedy|Drama|Romance
225,Fidelity Oxford Street Trust,Drama|Thriller
226,MFS South Carolina Municipal Bond Fund - R6,Thriller
227,Oaktree Emerging Markets Equity Fund Class I,Action|Thriller
228,Goldman Sachs Flexible Cap Fund Class R6,Comedy
229,Invesco Government Money Market Fund Class C5,Drama|Thriller
230,Invesco Oppenheimer Discovery Mid Cap Growth Fun,Drama|Thriller
231,American Funds International Vantage Fund Class,Adventure|Comedy
232,Asia Pacific Small Company Portfolio,Comedy|Drama|Romance
233,Telecommunications Ultrasector Profund Service,Drama
234,Ab Tax-Aware Real Return Income Shares,Comedy
235,Legg Mason Bw Global Income Opportunities Fund,Comedy|Drama
236,Ab International Small Cap Portfolio - Z,Action|Comedy|Romance
237,Usaa Ultra Short-Term Bond Fund Inst Shs,Comedy|Romance
238,Lazard Emerging Markets Core Equity Portfolio IN,Adventure|Children
239,Bridge Builder Municipal Bond Fund,Animation|Children|Comedy|Romance
240,MFS Series Trust III MFS High Income Fund I,Thriller
241,State Street Premier Growth Equity V.I.S. Fund,Children|Drama
242,Goldman Sachs Short Duration Government Fund Cla,Drama|Musical
243,Fidelity Advisor International Capital Appreciat,Children|Comedy|Fantasy
245,Vanguard Long-Term Investment Grade Fund Admiral,Crime|Drama
246,American Beacon Ahl Managed Futures Strategy Fun,Documentary
247,Fidelity Advisor Gold Fund - Class M,Crime|Drama
248,Mainstay Moderate Allocation Fund Class R3,Comedy
249,Kopernik International Fund Class Investor,Drama|Romance
250,Fidelity Advisor Freedom 2055 Fd Cl C,Children|Comedy
251,Core Plus Income Fund Investor Class,Action
252,Virtus Newfleet Tax-Exempt Bond Fund C,Comedy|Romance
253,Janus Henderson Global Real Estate Fund Class N,Drama|Horror
254,Ab Income Fund - A,Drama
255,Russell Inv CO Lifepoints Equity Gwth Strategy F,Comedy
256,MFS Blended Research Growth Equity Fund - Class,Comedy|Sci-Fi
257,American Century  Short-Term Government Fund - I,Mystery|Thriller
258,John Hancock Funds II Multimanager Lifestyle Con,Adventure|Children|Comedy|Fantasy|Romance
259,Hartford Dividend and Growth Fund Class A,Crime|Drama|Thriller
260,Dfa Large Cap International Portfolio,Action|Adventure|Sci-Fi
261,Blackrock Lifepath ESG Index 2045 Fund Investor,Drama
262,Jpmorgan Core Plus Bond A,Children|Drama
263,Virtus Kar Small-Mid Cap Value Fund Cl C,Drama
265,Oklahomadream 529 Portfolio 2022 Cl C,Drama|Fantasy|Romance
266,Victory Rs International Fund - Class C,Drama|Romance|War|Western
267,Putnam Intermediate-Term Municipal Income Cl Y,Comedy
268,Columbia Aggressive Track Ages 18+ Class Ag,Crime|Drama
269,The Gamco Global Growth Fd Cl I,Drama
270,Target Enrollment 2034/2035 Investment Option,Drama|Romance
271,Franklin Moderate Allocation Age 19+ Years Cl A,Drama
272,Allianzgi Small-Cap Fund Class C,Comedy|Drama
273,Nationwide Fund Cl A,Drama|Horror|Sci-Fi
274,Ab High Income Fund Inc. - Class K,Comedy
275,Ivy Emerging Markets Equity Fund Class R,Comedy
276,Cohen & Steers MLP & Energy Opportunity Fund IN,Comedy|Romance
277,Dreyfus Institutional Preferred Treasury Securit,Drama
278,Lord Abbett Corporate Bond Fund - Class C,Comedy
279,John Hancock Freedom 529 Future Trends Portfolio,Drama
280,VOYA Retirement Growth Portfolio Adviser,Drama|Thriller
281,Blackrock Lifepath Index Retirement Port Inv A S,Comedy|Drama|Romance
282,American Century Small Cap Growth Fund - Class A,Drama
283,Lord Abbett Growth Leaders Fd Cl I,Crime|Drama
288,Blackrock 40/60 Target Allocation Fund Investor,Action|Crime|Thriller
289,Mainstay Epoch International Choice Fund Simple,Comedy|Romance
290,Principal Fds Inc. Largecap Growth Fd I Cl R-1,Crime|Drama
291,Royce Micro-Cap Fund - Consultant Class,Drama|Thriller
292,Alger Growth & Income Fd Cl Z,Action|Drama|Sci-Fi|Thriller
293,Transamerica Small Cap Value Class R4,Action|Crime|Drama|Thriller
294,Blackrock Lifepath Dynamic 2050 Fund - Class A,Comedy|Romance
296,Nuveen Nwq Small Cap Value Fund Class R,Comedy|Crime|Drama|Thriller
298,Massmutual Premier Global Fund Administrative Cl,Drama
299,Principal Real Estate Securities 529 Portfolio C,Drama
300,Msif Active International Allocation Class C,Drama
301,Jpmorgan Global Bond Opportunities Fund - A,Drama|Romance
302,Wells Fargo 100% Treasury Money Market A Shares,Drama|Romance
303,MFS International Growth Fund - Class C,Action|Thriller|Western
304,Dunham Focused Large Cap Growth Fd Cl A,Comedy|Drama
305,John Hancock Funds II Emerging Markets Fd Cl R6,Comedy
306,Mainstay Mackay High Yield Corporate Bond Fund,Drama
307,Eaton Vance Dividend Builder Fd Cl C,Drama
308,Jpmorgan Smartretirement Blend 2045 Fd R5,Comedy|Drama
309,Lord Abbett Muni Incm TR - Lord Abbett High Yiel,Drama
312,Fidelity Health Savings Index Fund,Comedy
313,Dunham International Opportunity Bond Cl C,Animation|Children
314,Sei Multi-Asset Inflation Managed Fund Class F,Children|Drama|Fantasy|Mystery
315,Allianzgl Global Sustainability Fund Class Insti,Action|Drama|Thriller
316,Jpmorgan Intrepid Value Fund R6,Action|Adventure|Sci-Fi
317,Goldman Sachs Target Date 2025 Portfolio Service,Comedy|Drama|Fantasy
318,Target 2005 Fund - I Class,Crime|Drama
319,Columbia Conservative Track Ages 16+ Class C,Comedy|Drama|Thriller
320,Dws California Tax-Free Income Fund Institutiona,Film-Noir|Thriller
321,Invesco Global Growth Fund Class Y,Drama
322,Nationwide U.S. Small Cap Value Fund Class R6,Comedy|Drama
324,Victory Rs Global Fund - Class A,Comedy|Drama
325,BNY Mellon Global Dynamic Bond Income Fund Class,Comedy
326,Franklin Lifesmart 2030 Retirement Target Fund,Drama
327,American Funds Growth Portfolio Class R-1,Action|Comedy|Sci-Fi
328,Jpmorgan Ultra-Short Municipal Fund - A,Horror|Thriller
329,John Hancock US Global Leaders Growth Fund Class,Adventure|Drama|Sci-Fi
330,Invesco Short Term Bond Fund Class A  Shares,Action|Crime|Horror
331,Federated Government Reserves Fund - Class C,Drama
332,American Century Balanced Fund - R5 Class,Horror|Sci-Fi
333,Franklin High Yield Tax-Free Income Fund Class R,Comedy
334,Massmutual Retiresmart IN Retirement Fund Class,Drama
335,Columbia U.S. Social Bond Fund Class I,Mystery|Thriller
336,BNY Mellon Active Midcap Fund Class A,Drama|War
337,Transamerica Dividend Focused Class I2,Drama
338,American Funds 2045 Target Date Retirement Fd Cl,Action|Sci-Fi|Thriller
339,Delaware National High Yield Municipal Bond Fund,Comedy|Romance
340,John Hancock ESG International Equity Fund Class,Adventure|Drama|War
341,Franklin High Income Fund Advisor Class,Drama
342,BNY Mellon Balanced Opportunity Fund Class Y,Comedy
343,Jpmorgan Smartretirement 2040 Fund R5 Class,Children
344,Thornburg Better World International Fund Class,Comedy
345,Putnam International Equity Fund Class Y,Comedy|Drama
346,T. Rowe Price Small-Cap Stock Fund,Drama|Musical
347,VOYA Smallcap Opportunities Portfolio  Service,Drama|Film-Noir|Romance
348,Usaa Short-Term Bond Fd Insti Shs,Comedy
349,Vaughan Nelson Value Opportunity Fund Class Y,Action|Crime|Drama|Thriller
350,Virtus Seix Core Bond Fund A,Drama|Mystery|Thriller
351,Transamerica High Quality Bond Class R4,Comedy|Drama|Romance
352,Fidelity Advisor Utilities Cl A,Comedy|Drama
353,Fidelity Advisor Freedom 2025 Fund,Action|Crime|Fantasy|Thriller
354,Fidelity Advisor Environmental Bond Fund Class M,Drama
355,1290 Smartbeta Equity Fund Class T,Children|Comedy|Fantasy
356,Victory Munder Mid-Cap Core Growth Fund - Class,Comedy|Drama|Romance|War
357,Putnam Equity Income Fund Class B,Comedy|Romance
358,Janus Henderson Global Research Fund - D Shares,Drama
360,Sei Asset Allocation TR Moderate Strategy Alloc,Action|Comedy
361,Schwab Target 2025 Index Fund Institutional Shar,Comedy|Drama|Romance
362,Massmutual Premier Main Street Fund Service Clas,Adventure|Children|Romance
363,Pioneer Global Sustainable Growth Fund Cl C,Documentary
364,Fidelity Advisor New York Municipal Income Fund,Adventure|Animation|Children|Drama|Musical|IMAX
365,Dfa Two-Year Government Portfolio,Drama
366,Vanguard International Value Fund,Drama|Horror|Mystery|Thriller
367,BNY Mellon Diversified International Fund Class,Action|Comedy|Crime|Fantasy
368,Dws Treasury Portfolio Investment Class Shares,Adventure|Comedy|Western
369,GMO Climate Change Fund Class III,Drama
370,Wf Absolute Return Fund - R,Action|Comedy
371,Invesco Oppenheimer Fundamental Alternatives Fun,Comedy|Drama
372,Msilf ESG Money Market Portfolio Institutional S,Comedy|Drama|Romance
373,Federated Strategic Income Fund Class B,Thriller
374,Dws Tax-Exempt Portfolio Tax-Exempt Cash Manage,Children|Comedy
375,Blackrock Science and Technology Trust,Drama
376,MFS Commodity Strategy Fund Cl I,Action|Thriller
377,Government Obligations Fund Class P,Action|Romance|Thriller
378,MFS International Diversification Fund Class R 1,Comedy|Romance
379,Liquid Assets Portfolio Personal Class,Action|Sci-Fi|Thriller
380,Nuveen Symphony High Yield Income Fund Class C,Action|Adventure|Comedy|Romance|Thriller
381,Nuveen MA Municipal Bond Fd Cl C,Drama|Romance
382,Royce Premier Fund Investment Class,Drama|Horror|Romance|Thriller
383,Transamerica Dividend Focused Cl I,Western
384,Cavanal Hill World Energy Fund A Shs,Action|Crime|Drama
385,Stit Treasury Obligations Portfolio Corporate Cl,Drama
386,PGIM ESG Total Return Bond Fund Class Z,Drama
387,American Funds - Intermediate Bond Fund of Ameri,Action|Comedy
388,Great-West Small Cap Growth Fund - Institutional,Drama
389,Tiaa-Cref High-Yield Fund - Class W,Drama|Romance|War
390,Principal Real Estate Securities 529 Portfolio C,Action|Crime|Drama
391,Tcw Total Return Bond Fund Class N,Crime|Drama
392,Invesco Convertible Securities Fund Cl R5,Adventure|Animation
393,Columbia Aggressive Track Ages 14-15 Class C,Action|Adventure|Fantasy
396,Putnam Global Income Trust Cl C,Drama
404,Principal Funds Inc. - Lifetime Hybrid 2065 Cl,Documentary
405,Fidelity Advisor Short-Term Bond Fund,Action|Fantasy
407,Touchstone Value Fd Inst Cl,Horror|Thriller
408,T. Rowe Price U.S. Limited Duration TIPS Index F,Drama
409,Allianzgi Income Class and Growth Fund Class A,Crime|Drama
410,Usaa Mutual Fds TR Money Market Fund,Children|Comedy|Fantasy
412,KKR Credit Opportunities Portfolio Class D,Drama
413,Rydex Series Fds S&P Mid-Cap 400 Pure Value Fun,Comedy
414,Eaton Vance Limited Duration Income Fund,Comedy
415,Eaton Vance Tax-Managed Growth Fund 1.1 - Class,Comedy|Thriller
416,VOYA Senior Income Fund Class W,Western
417,Invesco Oppenheimer Global Multi-Asset Growth Fu,Comedy|Romance
418,WCM Focused International Opportunities Fund Ins,Drama
419,Jpmorgan Research Market Neutral Fund Cl A,Comedy
420,Sei Insti Mgd TR Large Cap Value Fund Class I,Action|Comedy|Crime|Thriller
421,Sei Multi-Asset Capital Stability Fund Class F,Adventure|Children|Drama
422,Pimco All Asset All Authority Class C,Thriller
423,Putnam Income Fund Class B,Action|Thriller
424,Blackrock Lifepath Index Retirement Fund - Inves,Drama
425,Absolute Strategies Insti Shares,Drama|Romance
426,Mainstay Mackay New York Tax Free Opportunities,Horror|Sci-Fi|Thriller
427,Invesco Peak Retirement 2015 Fund Class R,Drama|Mystery|Romance|Thriller
428,Massmutual Select Mid Cap Value Fund Class R4,Drama
429,Royce Smaller-Companies Growth Fund - Investment,Comedy
430,Alger Portfolios - Alger Mid Cap Growth Portfoli,Comedy|Drama
431,American Century Small Cap Value Fund R6 Cl,Crime|Drama
432,U.S. Socially Responsible Fund,Adventure|Comedy|Western
433,Columbia Conservative Track Ages 4-5 Class Ag,Comedy
434,Invesco World Bond Fund Class A,Action|Adventure|Thriller
435,MFS Emerging Markets Equity Fund Class R3,Comedy|Sci-Fi
436,Principal Fds Inc. Strategic Asset Mgmt Conserv,Drama|Thriller
437,Tributary Balanced Fd Instl,Comedy
438,American Funds 2065 Target Date Retirement Fund,Action|Comedy|Drama
439,Janus Henderson Mid Cap Value Fund - T Shares,Drama
440,Wf Core Bond Fd R,Comedy|Romance
441,Symmetry Panoramic US Equity Fund Class I Shares,Comedy
442,Pimco Government Money Market Fund Cl M,Action|Adventure|Sci-Fi
443,Kinetics Mutual Funds The Paradigm Fund Advisor,Adventure|Documentary
444,Columbia Massachusetts Intermediate Municipal Bo,Comedy|Romance
445,Jpmorgan Mid Cap Growth Fund-R4,Comedy
446,Aberdeen International Equity Fund Insti Class,Drama|Romance
447,Franklin Georgia Tax-Free Income Fund Class A1,Comedy|Romance
448,Ultra Short Japan Profunds Service Class,Drama
449,Mirova International Sustainable Equity Fund Cla,Comedy
450,Power Income Fund Class A,Comedy|Drama
451,Amg Managers Skyline Special Equities Fund - Cla,Drama|Mystery|Romance
452,Mutual Global Discovery Fund Class Z,Drama
453,Goldman Sachs Managed Futures Strategy Fd Cl R,Comedy|Romance
454,USA Mutuals Vice Fund-Institutional Class,Drama|Thriller
455,Allianzgi Midcap Fund Insti,Adventure|Children|Drama
456,Harbor Mid Cap Growth Fund - Retirement Class,Crime|Drama|Thriller
457,Hartford Schroders International Stock Fund Clas,Thriller
458,The Bond Fund of America Class 529-E Shares,Drama|Western
459,Columbia High Yield Municipal Fund Class I,Action|Adventure|Crime|Drama|Romance|Thriller
460,Massmutual Retiresmart 2035 Fund Class R4,Comedy
461,Federated Hermes Municipal Obligations Fund Svc,Drama|Romance
463,Putnam Fixed Income Absolute Return Fund Class A,Crime|Drama|Thriller
464,Dws Global Small Cap Fund - Class R6,Action|Adventure|Crime|Thriller
465,Morgan Stanley Insti Liq Fds Tax-Exempt Portfol,Action|Drama|War
466,Tiaa-Cref Emerging Markets Debt Fund - Class W,Action|Comedy|War
467,UBS Engage For Impact Fund Class P2,Comedy
468,Fidelity Freedom Blend 2010 Fund Class K,Comedy|Romance
469,Sanford C. Bernstein Diversified Municipal Pt,Drama|Romance
470,John Hancock Funds II Multimanager 2040 Lifetime,Comedy
471,Tactical Conservative Allocation Fund Class I,Comedy
472,John Hancock Funds II Multi-Index 2035 Preservat,Comedy|Drama
473,Fidelity Advisor Stock Selector Large Cap Value,Comedy|War
474,Allianzgi Mid-Cap Fund Admin Class,Action|Thriller
